"Product Name","Price_TND","Rating","Review count","Review","Category"
"Wholesale Berrcom Other    Sphygmomanometer Smart BP Cuff Blood Pressure Monitor"," 37,815","","","","Household Equipement"
"other    physical therapy equipments  atomizers portable mesh nebulizer inhaler suction machine"," 37,784","4.7","52","""good service""","Household Equipement"
"Non Invasive Blood Glucose Meter   For Diabetes use without strip","","4.9","31","""Good Service""","Household Equipement"
"2022 New Arrived BP Meter    Speaker Wrist Blood Pressure Monitor"," 30,542","4.6","23","""customer service""","Household Equipement"
"Fasting Blood Sugar Test Monitor Other    Blood Glucose Strips Test Strips"," 15,743","5.0","1","","Household Equipement"
"nebulizer machine electric asthma nebulizer"," 31,486","4.7","12","""excellent service""","Household Equipement"
"Wholesale Other    BP Adjustable Cuff Sphygmomanometer digital blood pressure monitor"," 26,764","5.0","8","""received on time""","Household Equipement"
"New Design High Quality   Yellow Back Glass Thermometer Glass Clinical Thermometer"," 1,103","4.7","1","","Household Equipement"
"Health Fitness  Hospital  Arm Digital Blood Pressure Monitor"," 17,601","5.0","88","""fast delivery""","Household Equipement"
"home blood pressure  promotion sphygmomanometer  diagnostic test"," 15,743","4.6","37","""excellent service""","Household Equipement"
"CE approved Physical Therapy Equipments air massage therapy for full legs and hipster circulation and relaxation"," 724,178","5.0","20","""Excellent service""","Household Equipement"
"PM50 wireless multiparameter patient monitoring vital signs telemedicine"," 406,170","4.5","24","""reliable supplier""","Household Equipement"
"Manual Aneroid Sphygmomanometer Blood Pressure Monitor Meter Tonometer Cuff Measure  With Stethoscope Home"," 14,169","4.5","6","","Household Equipement"
"Health  Blood Glucose Meter Accu Chek Glucose Meter Machine Other   Product"," 22,985","","","""customer service""","Household Equipement"
"diabetes  equipment Blood sugar testing  with test paper"," 11,021","5.0","8","""Perfect service""","Household Equipement"
"Sejoy   Equipment Strips for Glucometer"," 1,575","5.0","9","""Fast shipping""","Household Equipement"
"Factory direct  paralysis negative pressure sputum suction  baby  electric sputum suction"," 141,687","4.6","11","""Prompt delivery""","Household Equipement"
"home use BP Machine Sphygmomanometer Arm Tensiometers Electronic Blood Pressure Monitor"," 25,158","","","","Household Equipement"
"OEM Manufacturer Baby Temperature Clinical Digital Thermometers"," 1,354","5.0","6","""customer service""","Household Equipement"
"Good Price Healthcare  Products Electric Mode Power Wheelchair Foldable Electric Wheelchair"," 879,090","","","","Rehabilitation Equipement"
"BIOBASE  Equipment Wheelchairs Manual Lightweight Folding Electric Wheelchair"," 251,888","4.6","6","""professional service""","Rehabilitation Equipement"
"BIOBASE MFW880L  Rehabilitation Disabled Use Electronic Smart Wheelchair"," 251,888","4.9","11","""fast delivery""","Rehabilitation Equipement"
"Artificial Limbs Implant Prosthetic Leg Parts Below Knee Joint For Leg Prosthesis"," 173,173","4.8","66","""Fast Delivery""","Rehabilitation Equipement"
"Elderly Used Manual Travel Wheelchair MT  Comfortable Elderly Used Manual Travel Wheelchair For Disabled"," 81,864","4.6","19","""good supplier""","Rehabilitation Equipement"
"contactless humanl scanner temperature meter forehead thermometer"," 25,189","5.0","2","","Rehabilitation Equipement"
"CE Physiotherapy Orthopedic  Elbow Joint Protector Orthosis Brace Support Splint  With Dynamic Rom"," 48,489","","","","Rehabilitation Equipement"
"Whole-body Functional Training Equipment With Intelligent Sensor"," 34603,114","","","","Rehabilitation Equipement"
"Folding Walking Aid Walker Frame For Disabled  CRUTCH Lightweight Standing Frame Aluminum Hospital"," 12,595","5.0","4","","Rehabilitation Equipement"
"new design  magnetotherapy equipment pain relief electromagnetic magnetic super transduction PM-ST"," 6294,052","5.0","21","""excellent service""","Rehabilitation Equipement"
"LASTEK CES shock wave Insomnia sleep aid  Physical Therapy  Equipment"," 188,916","4.9","60","""fast delivery""","Rehabilitation Equipement"
"Hydrocollator  with hot packs"," 4093,180","5.0","8","""good service""","Rehabilitation Equipement"
"Hospital Rehabilitation Equipment Rehabilitation  Walking Frame Walking Assist"," 724,178","5.0","15","""Excellent customer service""","Rehabilitation Equipement"
"orthopedic adjustable  hip and knee brace support protector orthosis rehabilitation  with hinge for fracture adult"," 330,603","4.0","5","""fast delivery""","Rehabilitation Equipement"
"FES  Foot Drop System XFT G3 Walking Rehab  for Drop Foot Treatment"," 94,458","","","","Rehabilitation Equipement"
"Elastic Neoprene Hinged Knee Brace"," 80,857","4.8","2","","Rehabilitation Equipement"
"Hospital Rehabilitation Equipment Rehabilitation  Walking frame walking assist"," 724,178","4.7","7","""fast delivery""","Rehabilitation Equipement"
"Good Effect ED Electromagnetic Extracorporeal Shock Wave Therapy Machine Pain Relief"," 4678,820","4.9","11","""fast delivery""","Rehabilitation Equipement"
"Made in Italy premium quality Muscle modeling    slimming machine for export"," 26218,393","","","","Rehabilitation Equipement"
"Equipment Electric Patient Lifter Disabled Transfer  - Transfer Chair, Lifting"," 2830,592","","","","Rehabilitation Equipement"
"Foot Drop Treatment XFT-2001D Stroke Rehabilitation"," 94,458","","","","Rehabilitation Equipement"
"DMS Deep Muscle Stimulator physiotherapy"," 2833,740","5.0","8","""good service""","Rehabilitation Equipement"
"Adjustable Orthopedic Jewett Brace"," 175,378","4.8","2","","Rehabilitation Equipement"
"Top Quality Italian NHC  1.5ATA MC750 Hard Type Hyperbaric Chamber Cabin for  use"," 9326,154","","","","Rehabilitation Equipement"
"Children Transfer  Electric Patient Lift Hoist Sling Rehabilitation Therapy Supplies Funny Training  Care","","","","","Rehabilitation Equipement"
"Physiotherapy Hand Stroke Finger Exercise Training Function Equipment Robot Hand Rehabilitation"," 613,977","4.8","43","""Nice service""","Rehabilitation Equipement"
"Knee Ankle Foot Fixed Support Adjustable Lower Limb Orthosis Thigh Fracture Support Postoperative Ankle Rehabilitation","","","","","Rehabilitation Equipement"
"Power Assisted Standing Wheelchair Home-care Lifter Chair Rehabilitation  Standing Electric Chair For Handicapped Using","","3.8","4","","Rehabilitation Equipement"
"Product Hot Sale -hand Rehabilitation  TJ-OM007 2022 New for Hand Rehabilitation Robot BLUE/ORANGE Class I M;L';XL CN;GUA","","4.9","16","""fast service""","Rehabilitation Equipement"
"Hot Selling 3000ml lung breathing training  rehabilitation therapy training","","4.9","81","""fast shipping""","Rehabilitation Equipement"
"rehabilitation robot manufacture gait rehabilitation training"," 787150,000","","","","Rehabilitation Equipement"
"Prosthetic orthopaedic suppliers for sale Hand rehabilitation"," 26,764","4.8","66","""Fast Delivery""","Rehabilitation Equipement"
"Teleco High Quality Neck Traction  By Air Cervical Collar for Neck Disc Herniation"," 94,458","","","","Rehabilitation Equipement"
"Special Selling New Model Comfortable Walking Assist"," 75,567","","","","Rehabilitation Equipement"
"Knee Lower Limb rehabilitation training"," 4880,330","4.6","22","""good service""","Rehabilitation Equipement"
"Portable neck stretcher decompression and pain relief physiotherapy equipment cervical vertebra traction"," 113,350","5.0","1","""Fast delivery""","Rehabilitation Equipement"
"CES sleeping treatment  no side effect anti insomnia therapy for home use"," 188,916","4.9","60","""fast delivery""","Rehabilitation Equipement"
"Lumbar traction"," 503,776","5.0","8","""good service""","Rehabilitation Equipement"
"rehabilitation equipment stroke patient recovery hand exercises"," 944,580","5.0","20","""Excellent service""","Rehabilitation Equipement"
"MSLOE1251 Limbs Rehabilitation  For Active And Passive Rehabilitation Training"," 314,860","4.8","57","""Great customer service""","Rehabilitation Equipement"
"Portable Physiotherapy Vest Airway Clearance System Vibrator  For Child and Adult"," 7871,500","","","","Rehabilitation Equipement"
"FES Stroke Rehabilitation Foot Drop System Healthcare Footdrop"," 94,458","","","","Rehabilitation Equipement"
"Sling Exercise Equipment Suspension Therapy system with Ceiling Track for Children SET  for Exercise in Suspension"," 13494,900","","","","Rehabilitation Equipement"
"Folding Powered Mobility Scooter Chair Electric Wheelchair Chair for the Elderly rehabilitation"," 4417,486","5.0","17","","Rehabilitation Equipement"
"Orthopedics rehabilitation and Physiotherapy Extracorporeal Shock wave Therapy Equipment ESWT"," 2141,048","4.8","17","""good service""","Rehabilitation Equipement"
"Hospital Physiotherapy Rehabilitation Equipment Lower limb physical therapy"," 2833,740","4.7","7","""fast delivery""","Rehabilitation Equipement"
"BMC GII Auto CPAP E-20A Healthcare Portable Sleep Apnea Anti Snoring Home Use  with Humidifier Free Parts"," 1102,010","","","","Rehabilitation Equipement"
"Elderly wheelchair Assistant Disable stepping Wheelchair aids stair climbing machine  electric steps climbing machine"," 2015,104","","","","Rehabilitation Equipement"
"Physical therapy gait training equipment rehabilitation"," 14168,700","5.0","8","""good service""","Rehabilitation Equipement"
"Sling Exercise Therapy (S-E-T) for Child Balance Training Rehabilitation Training"," 3,149","","","","Rehabilitation Equipement"
"Shoulder Arm Abduction Orthosis  Rehabilitation Post Op"," 62,972","4.7","47","""on time shipping""","Rehabilitation Equipement"
"Passive Training Hand Therapy Equipment - Advanced Occupational Therapy Finger Rehabilitation Robotics"," 469,142","4.8","43","""Nice service""","Rehabilitation Equipement"
"Orthopedic  ankle joint protection fixation"," 93,388","","","","Rehabilitation Equipement"
"Eminent Upgraded Height Adjustable  Rehabilitation Fixed Support Orthopedic Thoracolumbar Brace"," 119,332","","","","Rehabilitation Equipement"
"TJ-HE001 Home Use Wrist Watch Therapeutic Apparatus High Blood Pressure  Laser Treatment Physiotherapy Equipment","","4.9","16","""fast service""","Rehabilitation Equipement"
"Top Quality  Lightweight Osteoarthritis OA Knee Brace Hinged Knee Brace"," 78,715","4.9","21","""excellent service""","Rehabilitation Equipement"
"AFO Foot Drop Brace  Ankle Foot Orthosis Support Drop Foot Postural Correction Brace"," 22,041","","","","Rehabilitation Equipement"
"adjustable  Therapy Knee Brace 3 Panels Of Knee Immobilizer Polyester Black Orthopedic Post Op Knee Support","","4.6","10","","Rehabilitation Equipement"
"Walker Fracture Boot Tall- Full  Recovery, Protection and Healing Walking Boot - Toe, Foot or Ankle Injuries"," 93,829","4.5","25","""Great supplier""","Rehabilitation Equipement"
"Disposable  Supply Post Surgery Compression Bra (P)"," 31,486","4.9","6","""Good service""","Rehabilitation Equipement"
"Health Care Rollator Convenient For Disabled Folding Adjustable Walker Physiotherapy Equipment With Double Hand Brake"," 31,486","","","","Rehabilitation Equipement"
"6 sections Chiropractic bed treatmeat equipment rehabilitation  machine"," 14168,700","5.0","1","","Rehabilitation Equipement"
"Comfortable adjustable Disabled Aluminum alloy Elbow underarm crutch"," 4,723","4.8","7","""Smooth transaction""","Rehabilitation Equipement"
"13cm  cast elastic surgical carbon fiber stockinette cover for prosthetic legs"," 62,972","4.9","28","""good service""","Rehabilitation Equipement"
"Order Directly Fitness  Physiotherapy Rehabilitation Equipment Orthosis Finger Flexion and Extension Training Class I","","4.8","66","""Fast Delivery""","Rehabilitation Equipement"
"Used Portable Diasbled Patient Electric Foldable Up And Down Stair Climbing Power Wheelchair rehabilitation equipment"," 2298,478","3.9","19","""On time shipping""","Rehabilitation Equipement"
"Color Low Temperature Thermoplastic Splint Materials for Occupation Therapy"," 62,972","5.0","3","""Great customer service""","Rehabilitation Equipement"
"Orthopedic arm sling with abduction pillow upper limb orthosis shoulder brace with pillow arm sling"," 19,994","4.8","18","""quick delivery""","Rehabilitation Equipement"
"Cheap price walking sticks with wheel  folding adjustable smart iron old man men people elderly foldable cane","","5.0","4","","Rehabilitation Equipement"
"MT  Factory Directly Sale detachable elderly electric wheelchair"," 1196,468","4.6","19","""good supplier""","Rehabilitation Equipement"
"MKX-YWJ-01A Superior Multi-Functional  Wheelchair with Back Opening Convenient for Patient Transfer, Shower and Commode"," 846,974","4.9","5","""Great service""","Rehabilitation Equipement"
"stroke rehabilitation  gait training robotics"," 787150,000","","","","Rehabilitation Equipement"
"Health Care Pressotherapy Lymphedema Compression Massage Machine 12 Chamber Blood Circulation, Sport Muscle Recovery 65W"," 2046,590","5.0","20","""Excellent service""","Rehabilitation Equipement"
"New ! In stock  Lightweight Standing Frame Aluminum Folding Walking Aid Walker Frame For Disabled Walking Frame"," 31,172","4.7","75","""excellent service""","Rehabilitation Equipement"
"TELECO Top Quality Inflatable  Cervical Collar Air Neck Traction"," 94,458","","","","Rehabilitation Equipement"
"VELPEAU  grade foot ankle protector gel version comfort Stabilizer rehabilitation sports ankle sock brace"," 53,212","4.7","1","","Rehabilitation Equipement"
"Hospital Cerebral Palsy  Equipment For Children Type Standing Frame"," 472,290","5.0","15","""Excellent customer service""","Rehabilitation Equipement"
"Adjustable high quality  Orthopedic drop ankle foot leg orthosis of Lower limb orthoses"," 330,603","4.0","5","""fast delivery""","Rehabilitation Equipement"
"New patent Foshan Highway Foldable steel durable  Rollator 3 wheel walker steel rollator with shopping bag"," 151,133","5.0","29","""good service""","Rehabilitation Equipement"
"BIOBASE Wholesaler Walking Stick Aluminum Four-Legged Crutches Cane  Walking Stick for Elderly"," 9,446","4.6","8","""good service""","Rehabilitation Equipement"
"Aluminum foldable lightweight electric wheel chair folding Recling electric power wheelchairmotor for  equipment"," 1511,328","5.0","1","","Rehabilitation Equipement"
"physiotherapy shockwave shock wave pain relief ultrasound shockwave therapy machine extracorporeal shockwave"," 5979,192","5.0","21","""excellent service""","Rehabilitation Equipement"
"Manufacturer Handicapped Wheelchair Foldable Electric Wheelchair"," 192,065","","","","Rehabilitation Equipement"
"Rehabilitation Therapy Hospital  Patient Transfer Disabled Lifting Chair Commode Shower Electric Wheelchair Seat Toilet"," 1190,171","5.0","6","""good supplier""","Rehabilitation Equipement"
"equipment walking aid stainless steel aluminum alloy crutches axillary crutches"," 25,189","5.0","9","""professional supplier""","Rehabilitation Equipement"
"Kooeej 2021 new  product Child children rehabilitation bicycle mini pedal exercise bike","","4.9","3","","Rehabilitation Equipement"
"CE Approved FES  Foot Drop Treatment for Stroke Rehabilitation"," 94,458","","","","Rehabilitation Equipement"
"rehabilitation walking assistant walking frame for adult using"," 488,033","4.7","7","""fast delivery""","Rehabilitation Equipement"
"multi function home care  rehabilitation nursing bed"," 3463,460","4.5","8","""fast shipping""","Rehabilitation Equipement"
"Hot Selling Manual Wheelchair small size portable rehabilitation  disabled self-pushing wheelchair"," 76,511","5.0","5","","Rehabilitation Equipement"
"Factory direct saleshospital beds prices medicalmedical beds for saleelectric  bed"," 1279,119","","","","Rehabilitation Equipement"
"BIOBASE MFW880L stair climbing wheelchair  Rehabilitation Disabled Use Electronic Smart Wheelchair"," 393,575","4.9","11","""fast delivery""","Rehabilitation Equipement"
"Equipment Functional Electrical Stimulation for Stroke Rehabilitation FES Stimulation Foot Drop Equipment"," 944,580","5.0","3","","Rehabilitation Equipement"
"Exercise Rehabilitation  Physical Therapy Frosted Table"," 34571,628","","","","Rehabilitation Equipement"
"Post Op Articulated Adjustable Range Of Motion For Arthritis  For Healing Osteoarthritis Leg Support Knee Brace"," 22,009","","","","Rehabilitation Equipement"
"Rehabilitation  Equipment Aluminum Mobility Folding Motorized Manual Electric Power Wheelchair"," 409,318","","","","Rehabilitation Equipement"
"Chinese Verified Supplier Pressure Relief   Air Bed Mattress With Pump"," 425,061","5.0","29","""good service""","Rehabilitation Equipement"
"Adjustable Elbow Brace  Arm Sling"," 44,081","4.9","21","""excellent service""","Rehabilitation Equipement"
"Lightweight  walker rollator with seat and brakes"," 110,201","4.8","16","""fast service""","Rehabilitation Equipement"
"Kooeej high quality cheap rehabilitation  care portable electric   mini exercise bike for disabled"," 2424,422","4.9","3","","Rehabilitation Equipement"
"Aluminum  disabled crutches  elbow for hospital and home used walking crutch for old"," 12,595","3.9","4","","Rehabilitation Equipement"
"TJ-OM007 robotic glove hand rehabilitation  stroke rehabilitation equipment","","4.9","16","""fast service""","Rehabilitation Equipement"
"Hot Selling Front 4 Wheel Rehabilitation Therapy Supplies 4 leg Folding stainless steel walker  Walking aid with wheel","","4.5","25","""Great supplier""","Rehabilitation Equipement"
"thermoplastic orthopedic phalangeal joints trigger finger splint"," 15,743","5.0","3","""Great customer service""","Rehabilitation Equipement"
"Recovery Rehabilitation Adjustable  Orthopedic Hip Abduction Brace Hinged Hip Support Brace For Adult"," 61,713","","","","Rehabilitation Equipement"
"Chiropractic bed   treatment rehabilitation equipment used in hospital 6 sections high quality hot sale"," 15743,000","5.0","1","","Rehabilitation Equipement"
"HKJD 2022 Hot Selling Manufacturer Orthopaedic Aircast Air Cam Fracture Short Walker Boot  Inflatable Walking Boot"," 78,715","4.6","10","","Rehabilitation Equipement"
"Disposable  Supply Implant Stabilizer Bands After Breast Surgery (D)"," 28,338","4.9","6","""Good service""","Rehabilitation Equipement"
"Hot sale  elderly fashion foldable adjustable walking sticks cane seat elderly led cane with chair price"," 14,484","4.8","7","""Smooth transaction""","Rehabilitation Equipement"
"Rehabilitation Knee Walker Physical Therapy Training Equipment Handicap Scooter Lightweight Disabled Walking Aids"," 151,133","","","","Rehabilitation Equipement"
"Rehabilitation equipment Orthopedic Prosthetic Limbs Infrared Oven , Infrared Heating Flat Oven"," 12846,288","4.8","66","""Fast Delivery""","Rehabilitation Equipement"
"Artificial limbs  Casting Elastic Surgical Stockinette Nylon Prosthetic leg"," 28,023","4.9","28","""good service""","Rehabilitation Equipement"
"Rehabilitation Equipment Electric  Hospital Bed Mattress For Homecare"," 881,608","4.7","14","""Great customer service""","Rehabilitation Equipement"
"YSFBL760101 High quality  rehabilitation commode chair for elderly"," 47,229","4.8","9","""carefully packed""","Rehabilitation Equipement"
"Used Portable Diasbled Patient Electric Foldable Up And Down Stair Climbing Power Wheelchair rehabilitation equipment"," 1889,160","3.9","19","""On time shipping""","Rehabilitation Equipement"
"Sport 1 Folding Transport Wheelchair with Full Arms and Removable Swing-Away Footrest, Black"," 125,944","5.0","1","","Rehabilitation Equipement"
"MT  Comfortable Foldable Design Steel Tube Full Bed Wheelchair For Sale"," 81,864","4.6","19","""good supplier""","Rehabilitation Equipement"
"Stroke rehabilitation  hanging hammer type hand exercise table finger flexion and extension trainer"," 277,077","4.9","81","""fast shipping""","Rehabilitation Equipement"
"Rehabilitation Glide Rotator elderly Walker   Therapy Supplies Foldable Knee Walker with knee support"," 122,796","","","","Rehabilitation Equipement"
"Amazon Hot Sale  Rehabilitation Neck Support Traction Brace Cervical Collar Neck"," 20,750","5.0","2","""Considerate service""","Rehabilitation Equipement"
"Light Weight Wheelchair Adjustable Folding  Manual Hand Push Wheelchair For Elderly Patient"," 91,310","4.7","15","""Good service""","Rehabilitation Equipement"
"wheelchair parts elevating leg rests for manual wheelchair  Rehabilitation Physical Therapy","","5.0","1","","Rehabilitation Equipement"
"Factory price supply Lightweight Folding Elderly Care Products Adjustable Height Home  care Aluminum walker","","4.8","15","""fast shipping""","Rehabilitation Equipement"
"Engin  Good price hospital wheelchair"," 629,720","5.0","6","""good company""","Rehabilitation Equipement"
"Stroke Rehabilitation Robot  Physiotherapy Equipment Hand Rehabilitation Trainer"," 771,407","4.5","43","""good customer service""","Rehabilitation Equipement"
"Robot assisted rehabilitation walking asist  walking rehabilitation equipment"," 787150,000","","","","Rehabilitation Equipement"
"Surgery Rehabilitation Finger Cot /Finger Splint"," 0,3149","5.0","10","""Fast delivery""","Rehabilitation Equipement"
"Adjustable Back Therapy Posture Corrector Clavicle Back Brace Support Shoulder Belt shoulder With Pump"," 11,084","4.8","18","""quick delivery""","Rehabilitation Equipement"
"VELPEAU Neck Brace Cervical Spine Pain Cool Soft Silicone Neck Collar  to Prevent Stiff Neck support brace for Sleeping"," 47,198","4.7","1","","Rehabilitation Equipement"
"Height Adjustable Walker REF913"," 15,743","","","","Rehabilitation Equipement"
"Disabled Manual Wheelchair Folding Portable Wheelchair for Disabled used","","","","","Rehabilitation Equipement"
"Elbow Crutch Adjusting S M L  Axillary Crutches Adjustable Lightweight Crutches"," 17,318","4.7","3","","Rehabilitation Equipement"
"TELECO New Generation  Inflatable Collar Neck Stretcher"," 62,972","","","","Rehabilitation Equipement"
"Folding Walker Aluminum  Walker Rehabilitation Therapy Supplies Lightweight walker for adults"," 37,784","5.0","2","""Professional supplier""","Rehabilitation Equipement"
"HOCHEY  Rehabilitation disabled wheelchair foldable full reclining manual chair lightweight disabled adult children chair"," 78,715","4.9","11","""Good Service""","Rehabilitation Equipement"
"Folding Hand adjustable footrest small size portable rehabilitation  Custom color wheelchair for disabled"," 85,013","5.0","5","","Rehabilitation Equipement"
"Wheelchair Lift with Toilet seat Cushion Nursing Chair Bath Patient Elderly Transfer Wheelchair for Home Hospital Care"," 784,002","4.9","5","""Great service""","Rehabilitation Equipement"
"China wheelchair  product wheelchair scale stand up wheelchair"," 154,282","4.5","11","""Customer Service""","Rehabilitation Equipement"
"Rehabilitation Walking Assistant Walking Frame For Adult Using"," 488,033","5.0","15","""Excellent customer service""","Rehabilitation Equipement"
"Aluminum folding mobility old people standing rollator walker walking frame for disabled people lightweight portable"," 31,172","4.7","75","""excellent service""","Rehabilitation Equipement"
"Hot Selling  Crutch Patient Underarm Walking Stick Old People elderly walking aids"," 18,262","","","","Rehabilitation Equipement"
"BIOBASE China 4 Legs Aluminum Alloy Lightweight Adjustable Elders Disabled  Walking Stick Quad Cane"," 9,131","4.6","8","""good service""","Rehabilitation Equipement"
"Chinese manufacturers  walking stick crutch for sale"," 10,076","","","","Rehabilitation Equipement"
"Rehabilitation  Equipment Aluminum Mobility Folding Motorized Manual Electric Power Wheelchair","","","","","Rehabilitation Equipement"
"Luxurious universal wrist protectors  gel pads with high quality","","","","","Rehabilitation Equipement"
"eswt shockwave therapy machine erectile dysfunction rehabilitation therapy eswt  supplies"," 5399,849","4.9","11","""fast delivery""","Rehabilitation Equipement"
"orthopedic rehabilitation healing Post Operative shoes"," 7,872","","","","Rehabilitation Equipement"
"New Arrival Wholesale Supply Cheap Electric Wheelchair For Disabled  Equipment For Rehabilitation"," 333,752","","","","Rehabilitation Equipement"
"Stroke hemiplegia rehabilitation training  physical therapy equipment finger board  grip ball fixed finger grip"," 15,429","","","","Rehabilitation Equipement"
"High performance neurorehabilitation  rehabilitation equipment Luna for neuro-motor rehabilitation"," 108280,354","","","","Rehabilitation Equipement"
"Cheap  Rehabilitation Therapy Supplies Walking Training Folding Aluminum Alloy Walking Aid for adult and kid"," 50,378","5.0","17","""good customer service""","Rehabilitation Equipement"
"chair for bathing the elderly disabled patients","","","","","Rehabilitation Equipement"
"Rollator folding walker portable adjustable shopping  outdoor aluminium rollator walker with seat"," 110,201","4.8","16","""fast service""","Rehabilitation Equipement"
"BIOBASE  Rehabilitation Wheelchairs Price Manual Wheelchair for Patients"," 311,712","4.8","13","""Customer Service""","Rehabilitation Equipement"
"knee ankle foot support brace orthosis adjustable","","5.0","14","""fast shipping""","Rehabilitation Equipement"
"BIOBASE Walking Stick One Foot Portable Folding  Walking Stick Cane for Healthcare Hospital","","4.6","15","""Fast delivery""","Rehabilitation Equipement"
"hot selling  axillary crutches aluminum"," 10,076","4.0","2","""good service""","Rehabilitation Equipement"
"Large Rollator Walker Compact Foldable Easy to Fold Lift & Carry Comes with Cane Holder Walking Rollator"," 122,796","4.7","15","""Good service""","Rehabilitation Equipement"
