"Product Name","Price_TND","Rating","Review count","Review","Category"
"Implant Surgical Instruments Kit Dental Bone Surgery Preparing Set PRF Box"," 157,430","5.0","13","""Professional service""","Dental "
"Teeth Cleaning Dental Hygiene Kit 4 Tools Set Dentist Approved /Dental Explorers /1 X 4 Adult Green Hexagonal GREEN"," 9,446","","","","Dental "
"Wholesale Price Electrosurgical  Bayonet Bipolar Forceps Surgical Instruments Diathermy Forceps"," 9,446","","","","Dental "
"Digital LED Display Dental Equipment Intraoral Camera Dental Endoscope Monitor For Dental Clinic"," 519,519","4.7","18","""Excellent service""","Dental "
"Dental Equipment High Quality Dental Handpiece Oil Lubrication Machine And Cleaner"," 299,117","4.0","2","""good service""","Dental "
"Wholesale Price Electrosurgical  Bayonet Bipolar Forceps Surgical Instruments Diathermy Forceps"," 6,298","","","","Dental "
"15PCS Multicolor Dental Dentist Rubber Dam Clamp Set Orthodontic Material Dentist Lab  Perforator Puncher Teeth Care Plier"," 0,6298","","","","Dental "
"Dental Tools Kit 6PCS Teeth Cleaning Tools Set Oral Care Kit with Tooth Pick High quality in wholesale low price"," 7,242","","","","Dental "
"Bone Compression Kit Surgical Implant Dental Surgery Instruments"," 220,402","","","","Dental "
"Manufacture Stainless Steel Surgical Bone Holding Forceps"," 110,201","5.0","7","""Great packaging""","Dental "
"Dr Whiten  Dental Whitening Kit Bleaching Accelerator"," 47,229","4.7","1","","Dental "
"Hot Sale  Lower Price Good Quality Teeth Root Canal Dental Gates Drills Files"," 6,298","5.0","2","","Dental "
"Classical Adec Dental Unit  Functional Clinic Hydraulic Dental Chair"," 6923,772","4.7","2","","Dental "
"ECO Dental Composite Sets  New 6 pcs Dental Composite Instruments Gold Complete Set With Kit Orthodontic plier BY DH"," 37,784","","","","Dental "
"Dental  Equipment Spot Welder Machine Instruments"," 23614,500","","","","Dental "
"Dental  Myricko 4-hole high speed Dental Handpiece with Push Button"," 45,214","","","","Dental "
"Root Fragment Stieglitz Stainless Steel  Dental Instruments Stainless Steel Instruments"," 10,548","","","","Dental "
"Factory Wholesale  Manufacture Price Cheap China Dental Needle Irrigation"," 1,260","","","","Dental "
"Dental Orthodontic Wire Bending Weingart Pliers Set with TC Ortho"," 15,743","","","","Dental "
"Dental Extracting Forceps Pattern Made with  Grade Steel"," 14,327","","","","Dental "
"High Quality Single Use Plastic .Handle Dental Mirror. Dental Examination Diagnostic Mouth Mirror"," 1,575","","","","Dental "
"Codyson  dental tools Ultrasonic Cleaner With CE ROHS GS Approval CD - 4821"," 173,551","4.8","1","""Properly packed""","Dental "
"Dental Lab Denture Dental Flexible Denture Dental Price"," 132,242","","","""Nice job""","Dental "
"Dental Orthodontic Root tip Elevator Dentistry Dentist Instrument Full  Stainless Steel"," 5,038","","","","Dental "
"2021 Wholesale Factory Store  Hospital  Equipment Cpap Machine With Humidifier NLF-200C"," 14168,700","5.0","14","""reliable customer service""","Dental "
"YSDEN-SEAL06   Dental sealing machine dental unit instrument"," 818,636","4.8","9","""carefully packed""","Dental "
"Minter  Dental Endodontic Treatment Wireless Brushless Endo Motor With Apex Locator Rechargeable Base"," 563,600","4.8","22","""Excellent service""","Dental "
"dental equipment instrument fit EMS/WOODPECKER ultrasonic piezo handpiece E4 Endodontic scaler tips","","4.8","13","""good service""","Dental "
"Disposable Dental Oral Cavity Kit"," 0,3149","4.9","14","""good service""","Dental "
"Sunlight dental unit with high quality   dental chair with two dentist stool"," 3148,600","5.0","6","""Good service""","Dental "
"Hot selling China    Ultrasonic Cleaner with cheap price,UC-60S"," 629,720","","","""good packaging""","Dental "
"Good price  dental teeth whitening accelerator"," 62,972","5.0","2","""Satisfactory business""","Dental "
"New hot selling high-quality laser pen  high-power laser pen"," 15743,000","4.6","3","""Fast service""","Dental "
"Dental  handpiece cleaning lubricate system"," 278,841","4.8","29","""good service""","Dental "
"Dental Equipment's Dental Implant Stainless Steel Explorer Probe   | Caremed Instruments"," 0,3149","","","","Dental "
"Portable digital rvg dental x-ray sensor x ray dental xray sensor"," 3085,628","","","","Dental "
"dental cleaning kit including Stainless Steel scaler probe excavator and mouth mirror"," 0,0315","","","","Dental "
"2022  Endoscope High Precision Dental Scaler Ultrasonic Cleaner Ultrasonic Periodontal Therapy","","","","","Dental "
"Stainless Steel Needle Holders Dental Needle Holders Surgical Forceps In Stock now","","","","","Dental "
"Dental Impression Trays Set of 6 Stainless Steel health   Perforated Autoclavable"," 3,118","","","","Dental "
"Manikins For Sale Dental Products","","","","""fast shipping""","Dental "
"3pcs/set Tooth Orthodontic Trainer Silicone Material  Guard"," 11,021","4.6","21","""Fast shipping""","Dental "
"Good Quality Plastic/Polymer S/M/L Autoclave Dental Impression Tray Dental Model Base for  Treatment"," 7,557","4.2","7","","Dental "
"dental mini 0.022 sets metal teeth orthodontic bracket"," 4,062","","","","Dental "
"Dental Supplies  Colorful Disposable Nylon Dual-use Polishing Soft Cup"," 0,1638","5.0","2","""neatly packaged""","Dental "
"Best selling XR  good dental ultrasound scaler for application"," 623,423","","","","Dental "
"Teeth Polishing Handpiece  Dental Hand Piece 4 Holes Press Water Dental Handpiece"," 66,121","4.8","8","""smooth transaction""","Dental "
"HOT Orthodontic  Hole punch Forming Forceps/Tear Drop Thermal Forming Plier Orthodontic Aligner Plier Clear Appliance","","5.0","9","""excellent service""","Dental "
"Dental Composite Sets  New 6 pcs Dental Composite Instruments Gold Complete Set With Kit Orthodontic plier BY DH"," 40,932","","","","Dental "
"Dental Care Set  Tooth Cleaning Tartar Dental Oral Hygiene Kit High quality in wholesale low price"," 6,140","","","","Dental "
"Dental Equipment Handpiece Scaler Light Cure Oral Camera air compressor  Clinic Cheap Dental Chair set"," 7833,717","4.7","2","","Dental "
"Root elevators Bein 2mm Dental Surgical  Instruments The Basis of Surgical Instruments"," 4,251","","","","Dental "
"Cleaning board sedimentation tank gypsum filter  dental laboratory equipment"," 122,796","4.0","2","""good service""","Dental "
"Dentist orthodontic Adson TC Forceps Surgical Tweezers  Manufacturer Dental Tweezer"," 6,266","","","","Dental "
"portable dental cleaning dental ultrasonic scaler machine dental scaler tips"," 220,402","4.7","1","","Dental "
">Dental Orthodontic Root Elevator 720/27 720/28 Dentistry Dentist Instrument Full  Stainless Steel"," 5,038","","","","Dental "
"dental lab 3d printed partial dentures denture dental silicone"," 132,242","","","""Nice job""","Dental "
"Dental Implant Box -  High Grade PRF and GRF Box"," 157,430","5.0","13","""Professional service""","Dental "
"Hot selling China    Ultrasonic Cleaner with cheap price,UC-031S"," 472,290","","","""good packaging""","Dental "
"Dental Elevator Root Luxuriating Curved Tip Stainless Steel Elevators | Caremed Instruments"," 6,298","","","","Dental "
"Dental Scraper Tool  Stainless Steel Dental Tarter Scraper for Tooth Dentist"," 0,0315","","","","Dental "
"Excellent Quality Stainless Steel Dental Instruments Long Dentist Mouth Mirror"," 6,298","","","","Dental "
"Health &      design for Dental Tweezer Dental instruments  Equipment"," 3,118","","","","Dental "
"Hot Selling Plastic/Polymer S/M/L Autoclave Dental Impression Tray Dental Base Plate for  Treatment"," 7,557","4.2","7","","Dental "
"Manufacture Cheap 50 Set Teeth Orthodontics Braces Mbt Orthodontic Brackets"," 4,346","","","","Dental "
"designed for tooth green cleaning hard root canal cleaning brush"," 0,4723","5.0","2","""neatly packaged""","Dental "
"XR Filling Auxiliary Materials Endo-Points Gutta Percha Points With Depth Marked 04 Taper For  Dental"," 6,613","","","","Dental "
"best selling Cone beam CT multifunctional dental CBCT Radiology Equipment"," 78715,000","","","""fast shipping""","Dental "
"2022 hot dental orthodontic  OEM Tear Drop Thermal Forming Plier orthodontic aligner plier clear appliance instrument"," 141,687","5.0","9","""excellent service""","Dental "
"Electronic OEM Blood Glucose Test  Diabetic Machine"," 9,446","5.0","9","""Fast shipping""","Household Equipement"
"Portable Sphygmomanometer bp Monitor Checking  Professional Upper Arm Digital Ambulatory Manual Blood Pressure Monitor"," 25,158","4.7","6","","Household Equipement"
"Handheld Dynamic ECG Systems 12 Channel 24 Hours Holter ECG"," 752,516","5.0","1","","Household Equipement"
"Blood Sugar Testing Equipment   Portable Blood Glucometer"," 23,615","5.0","2","","Household Equipement"
"Blood Pressure  Cofoe Wholesale BP Monitor    Automatic Arm Blood Pressure Monitor"," 24,874","5.0","1","","Household Equipement"
"Upper Arm Blood Pressure Monitor Sphygmomanometer"," 23,615","4.8","29","""great service""","Household Equipement"
"Other    ACCU-ANSWER Glucometro Diabetes Digital Blood Sugar Monitor Kit Blood Glucose Testing Machine","","4.7","87","""Nice service""","Household Equipement"
"bp blood pressure monitor other"," 25,189","4.7","2","""good service""","Household Equipement"
"Self monitoring portable intelligent  digital blood glucose meter  glucometer strips blood glucose meter"," 12,500","4.6","93","""Great service""","Household Equipement"
"Portable Blood Pressure Apparatus Machine Digital BP Blood Pressure Monitor Upper Arm For","","4.6","60","""fast delivery""","Household Equipement"
"Cheap Price Insumos Medicos Equipos    Ultrasonic Portable Asthma Inhaler Mesh Nebulizer Machine"," 25,189","4.8","28","""Perfect service""","Household Equipement"
"Handheld nebulizers inhaler  Ultrasonic mesh nebulizer portable nebulizador portatil"," 23,615","4.7","55","""Good supplier""","Household Equipement"
"arm type digital blood pressure electronic bp machines"," 20,466","4.5","43","""good customer service""","Household Equipement"
"physical therapy equipments  atomizers portable mesh nebulizer inhaler suction machine"," 37,784","4.7","52","""good service""","Household Equipement"
"Other    One Button Start Portable Mahince Nebulize Ultrasonic Inhaler"," 28,338","4.7","41","""professional service""","Household Equipement"
"High Quality Sphygmomanometer Arm Tensiometers OEM BP Machine Electronic Blood Pressure Monitor Other"," 25,158","4.9","53","""professional service""","Household Equipement"
"supplies other    equipment ultrasonic portable inhaler mesh nebulizer machine","","4.9","103","""Excellent service""","Household Equipement"
"electronic digit tensiometer bp blood pressure machine blood pressure meter blood pressure monitor","","4.6","8","""good service""","Household Equipement"
"Factory price ACCU ANSWER 4 in 1 blood glucose meter cholesterol and uric acid hemoglobin meter"," 72,418","4.9","31","""Good Service""","Household Equipement"
"Other    Blood Pressure Testing Equipments Tensiometro Manual"," 12,595","4.8","19","""Fast service""","Household Equipement"
"Other    led light therapy  PDT Treatment body pain relief"," 170,025","4.9","67","""fast shipping""","Household Equipement"
"6 in 1 Smart  telemedicine  ecg holter SP02 temperature blood sugar sensor all in one portable"," 330,603","4.8","7","""Quick shipping""","Household Equipement"
"Exercise Rehabilitation Sports Injury Muscle Pain Relief Acupuncture lllt Cold Laser Therapy","","4.9","60","""fast delivery""","Household Equipement"
"Supplies Other    Equipment Ultrasonic Portable Inhaler Mesh Nebulizer Machine"," 18,861","4.4","21","""customer service""","Household Equipement"
"Wholesale  Blood Pressure Machine   BP Cuff Sphygmomanometer Smart Telehealth Blood Pressure Monitor","","4.9","18","""Quick shipment""","Household Equipement"
"physiotherapy anti diabetic watch for stroke rehabilitation Alzheimer's disease improve blood oxygen","","4.5","16","""Quick delivery""","Household Equipement"
"Homecare   NE-J01 mini  nebulizer oxygen concentrator nebulizer"," 28,338","4.5","24","""reliable supplier""","Household Equipement"
"MY-G029G    arm electronic sphygmomanometer digital blood pressure monitor"," 25,189","4.4","16","""good service""","Household Equipement"
"CE Certified 5-Second Rapid Blood Glucose Meter Accurately Tests"," 16,058","4.9","28","""Fast service""","Household Equipement"
"Upper Arm Digital Apparatus Blood Pressure Monitor Other"," 21,065","5.0","2","","Household Equipement"
"Hot    Millimeter Wave Instrument For Body Care And Disease Therapy"," 2200,872","4.7","35","""Good service""","Household Equipement"
"Hot Selling  Hospital Equipment Automatic Portable Cpap Machine Bipap Apap  For Night Sleep Snoring Home Use"," 566,748","4.6","11","""fast shipping""","Household Equipement"
"Manufacturers Sale  Grade Inhalation Nebulizer Compressor other"," 31,486","5.0","4","","Household Equipement"
"Best selling products  and  supplies portable compressor nebulizer machine"," 29,912","5.0","21","""fast delivery""","Household Equipement"
"Emergency Supplies  Manual Hand-Operated Suction Pump Set Portable Suction  With CE","","4.5","6","","Household Equipement"
"tensiometro manual blood pressure monitor aneroid sphygmomanometer with stethoscope"," 15,114","4.9","29","""fast service""","Household Equipement"
"Durable  Sprayers Portable  Compression Nebulizer Health Care"," 22,041","5.0","8","""Perfect service""","Household Equipement"
"Upper Arm BP Monitor Blood Pressure with large Cuff 22-42cm for Adult BP Equipment"," 43,766","5.0","7","""quick delivery""","Household Equipement"
"Durable  Sprayers Portable  Compression Nebulizer Health Care"," 30,857","4.9","3","""good job""","Household Equipement"
"HES-3 digital vital monitor mobile  equipment handheld portable telemedicine  for clinic"," 3148,600","4.3","12","""timely service""","Household Equipement"
"Wholesale Berrcom Other    BP Cuff Sphygmomanometer Smart Blood Pressure Monitor"," 37,815","","","","Household Equipement"
"supplies other    equipment ultrasonic portable inhaler mesh nebulizer machine"," 28,338","4.8","7","""Smooth transaction""","Household Equipement"
"Other    Other  consumables Tubing Wrap Soft CPAP/BiLevel Hose Tube Cove"," 34,635","4.8","16","""good experience""","Household Equipement"
"Factory Cuastom Upper Arm Digital Bp Apparatus Blood Pressure Monitor Other"," 21,065","4.8","55","""customer service""","Household Equipement"
"Health  Supplies Other    Handheld Portable Handheld Pulse Oximeter  Equipment"," 179,471","4.8","64","""fast Delivery""","Household Equipement"
"JASUN Fast Dispatch LOW NOISE Inhalation Mesh Nebulizer for  Care for Cough Other"," 37,784","5.0","14","""excellent service""","Household Equipement"
"Starcare Other  Consumables Digital Thermometer Flexible Tip  Baby Care"," 1,512","5.0","6","""customer service""","Household Equipement"
"High Quality Portable Nebulization    O2 oxygen concentrator generator for room"," 346,346","2.1","8","","Household Equipement"
"Other    AVICHE A35 1-5l  Oxygen Concentrator with Nebulizer"," 755,664","4.7","1","","Household Equipement"
"ChoiceMMed Electrocardiografo Ekg  Recorder Elettrocardiografo Wireless Monitor Blue Tooth Ecg Machine  MD100B"," 206,234","5.0","1","","Household Equipement"
"Blood pressure machine for home use healthcare supply wholesale korean"," 62,972","","","","Household Equipement"
"Competitive price thermometer    thermometer baby digital thermometer"," 1,323","4.7","2","","Household Equipement"
"Factory Price Mute Mini Home Inhaler  Ultrasonic Atomizer USB Portable Handheld Mesh Nebulizer"," 29,881","5.0","3","","Household Equipement"
"Ready To Ship Digital    Wrist Type Heart Rate Blood Pressure Monitor","","4.6","8","""good service""","Household Equipement"
"Hospital healthcare equipment  machine  equipment home care   electric suction machine"," 147,985","","","","Household Equipement"
"portable ecg machine pocket ecg holter holter ecg"," 280,226","4.9","102","""great service""","Household Equipement"
"blood pressure monitor cheap digital blood pressure monitor","","","","","Household Equipement"
"Manual Aneroid Sphygmomanometer Blood Pressure Monitor Meter Tonometer Cuff Measure  With Stethoscope Home"," 14,169","4.3","12","""fast shipping""","Household Equipement"
"health care lcd thermometers checking oral thermometer"," 0,7872","","","""great service""","Household Equipement"
"Stable performance high efficiency other    5l 10l  grade oxygen-concentrator"," 591,937","5.0","1","","Household Equipement"
"Wireless Portable Knee Massage , Health &  Portable Electronic Knee Massager Warm Laser"," 94,458","4.2","5","""nice service""","Household Equipement"
"BERRY   professional cheap nice big display Pulse Oximeter Fingertip"," 9,446","4.9","8","""quick shipping""","Household Equipement"
"KONHEAL    Cytometer  Ce Hospital Baby Digital Handheld Finger Clip Fingertip Pulse Oximeter"," 9,415","5.0","16","""good work""","Household Equipement"
"CE ISO Approved Home   Supplies Portable Compressor Electronic Diffuser Nebulizer"," 64,547","5.0","3","""arrived quickly""","Household Equipement"
"ORIENTEMD best mercury sphygmomanometer   with CE ISO"," 27,078","4.2","6","""good service""","Household Equipement"
"Factory    nebulizer machine compact inhaler electric compressor nebulizer"," 32,746","5.0","2","""Perfect service""","Household Equipement"
"Battery Operated  Ultrasonic Nebulizer for Asthma Portable Electric Inhaler Machine"," 88,161","4.5","2","""customer service""","Household Equipement"
"Standard  supplies blood pressure monitoring  arm blood pressure meter"," 21,096","5.0","10","""Fast shipping""","Household Equipement"
"Berrcom New Product LCD Screen Thermometer Children'S  Thermometer Fever Thermometer"," 1,575","4.7","6","","Household Equipement"
"2022    Intelligent Type Electronic Blood Pressure Monitor-Upper Arm Type"," 18,262","4.9","14","""great company""","Household Equipement"
"Best Selling Durable  Electronic  Sphygmomanometer"," 20,466","4.9","9","""nice customer service""","Household Equipement"
"HRA-II disease detective machines for high blood pressure,diabetes,  no harm to the body"," 3,149","","","","Household Equipement"
"BP Cuff Sphygmomanometer Blood Pressure Monitor Health Digital Blood Pressure Monitor","","","","","Household Equipement"
"YUWELL  Manual Desktop Blood Pressure Measuring Instrument Upper Arm Type  Arm Type Measuring Sphygmomanometer"," 472,290","","","","Household Equipement"
"New High Quality Good Price Four Ball Breathing Trainer Lung Capacity Lung Function Exercise Rehabilitation"," 21,726","4.6","8","","Household Equipement"
"Spo2 Monitor  Equipment Bluetooth   To Test The User Oxygen Saturation And Pr Finger Pulse Oximeter"," 47,229","4.9","14","""fast shipment""","Household Equipement"
"Hot Selling  Portable   BP Machine Backlight Monitor Automatic For Adult Digital Blood Pressure Monitor","","5.0","2","""fast delivery""","Household Equipement"
"top selling   automatic free turgoscope B05 and blood pressure monitor with LCD display"," 28,653","","","","Household Equipement"
"Diabetes  Digital Test Strips International Blood Sugar Meters Monitors  Electronic Digital Blood Glucose Meter"," 22,041","4.3","16","""fast delivery""","Household Equipement"
"Upper Arm BPM ambulatory blood pressure Monitor With BPM monitor with app integrated bp monitoring","","5.0","5","","Household Equipement"
"EG20 New products family home use Snap ECG /portable mini ECG machine"," 157,430","4.8","16","""Fast shipping""","Household Equipement"
"Electronic Wrist Hot Sale Figital Wrist  Blood Pressure Monitor"," 37,784","5.0","2","""good supplier""","Household Equipement"
"Professional Dual Head  Cardiology cute Stethoscope For Doctor Nurse Vet Student Chest Piece"," 3,936","4.6","29","""fast delivery""","Household Equipement"
"Factory Price Electric Nasal Irrigation  Nose Cleaning  For  Use"," 37,784","","","","Household Equipement"
"Blood pressure monitor, portable  or  aneroid sphygmomanometer with stethoscope"," 18,892","4.7","24","""amazing customer service""","Household Equipement"
"Hochey  elderly monitoring  pediatric blood pressure Sphygmomanometer infant Smart BP Monitor"," 25,189","","","","Household Equipement"
"Blood Glucose Meter   for Measuring Blood Sugar Glucometer with Diabetic Test Strips for Diabetes Glucometro"," 19,301","4.9","8","""Excellent service""","Household Equipement"
"Professional Hospital   Upper Arm Digital Blood Pressure Monitor With LCD Display"," 34,635","5.0","6","""fast delivery""","Household Equipement"
"clinical   Electronic Sphygmomanometer Arm digital bp machine Blood Pressure Monitor factory"," 20,781","5.0","1","","Household Equipement"
"Sphygmomanometer  Arm Wrist Digital Blood Pressure Monitor"," 31,455","5.0","11","""great supplier""","Household Equipement"
"Handheld Baby Cvs Asthma Inhaler Mesh Nebulizer Machine Portable  Ultrasonic Nebulisers  Nebulizador Portatil"," 31,172","4.9","18","""Fast shipping""","Household Equipement"
"OEM color nebulizer   inhaler compressor nebulizer listed on Amazon"," 29,031","4.8","22","""good customer support""","Household Equipement"
"Blood Pressure Monitor    with YE660E Family Heath Care Electric Plastic Ce Yuwell Large LCD Display"," 53,527","","","","Household Equipement"
"High Quality Non Invasion Machine  Test Blood Sugar Monitor with Test Strip  Blood Glucose Meter"," 30,857","4.3","3","","Household Equipement"
"oxygen oxygen concentrator 5L high capacity portable   cheap wholesale price"," 629,720","","","","Household Equipement"
"Ozone generator ozone machine ozone air purifier  sterilization disinfection formaldehyde odor removal"," 374,684","5.0","8","","Household Equipement"
"Manual Blood Pressure Monitor Aneroid Sphygmomanometer with Cuff and Single Head Stethoscope Set/Kit","","4.8","75","""good service""","Household Equipement"
"Home Use Portable Oxygen Generator factory Price 93% high purity Portable Oxygen Concentrator oxygen"," 425,061","5.0","97","""good service""","Household Equipement"
"Electronic Blood Pressure Measuring Instrument  Automatic Hypertension Manometer","","4.4","15","""reliable company""","Household Equipement"
"mini first aid kit for car use or outdoor travel use"," 12,563","4.8","27","""fast delivery""","Household Equipement"
"Upper Arm Cuff Digital smart accuracy heart rate monitor  Blood Pressure Monitor","","5.0","21","""Excellent experience""","Household Equipement"
"Clinical   8D NLS blood pressure monitor cardiovascular system health protection instrument"," 1007,552","4.7","98","""helpful customer service""","Household Equipement"
"Portable Retractable Medica Compressor Nebulizer machine   for cure lung diseases CNB69016","","4.8","29","""great service""","Household Equipement"
"Other    Portable Cholesterol Blood Glucose Hemoglobin Meter 4 In 1 Health Care Machine","","4.7","87","""Nice service""","Household Equipement"
"Wholesale  House Use  Checking  Arm Type Electronic BP Blood Pressure Check Machines Digital"," 14,169","4.6","93","""Great service""","Household Equipement"
"Blood Sugar Test Machine Multifunctional Intelligent Noninvasive Optima Blood Glucose Meter"," 19,837","4.6","55","""good service""","Household Equipement"
"mini cough drug Portable Handheld Inhaler baby mesk nebulizers nebul mesh ultrasonic  nebulizer for children"," 26,764","4.7","55","""Good supplier""","Household Equipement"
"All in one telehealth homecare    blood pressure monitor diabetes monitor glucometro"," 330,603","4.8","7","""Quick shipping""","Household Equipement"
"Other    blood pressure"," 25,189","4.8","19","""Fast service""","Household Equipement"
"Hospital    digital bp monitor machine cheap upper arm blood pressure monitor price"," 23,615","4.9","53","""professional service""","Household Equipement"
"Pain Relief Photodynamic Therapy for Menstrual Pain Sports Injuries Wound Healing"," 3,149","4.5","16","""Quick delivery""","Household Equipement"
"digital blood pressure monitor"," 21,411","5.0","5","""good service""","Household Equipement"
"pdt therapy other     pain relief photodynamic skin care"," 1133,496","4.9","67","""fast shipping""","Household Equipement"
"JASUN Fast Dispatch    Powered Upper Arm Digital Blood Pressure Monitor","","5.0","14","""excellent service""","Household Equipement"
"Manufacture health homecare   CE approved smart ultrasound handheld mesh nebulizer diffuser"," 34,005","4.9","103","""Excellent service""","Household Equipement"
"Wholesale remote monitoring   arm type blood pressure monitor"," 62,658","5.0","3","""nice service""","Household Equipement"
"Factory Wholesale Price Clinical Rigid Digital Thermometer    Oral Rectal Armpit Thermometers for Baby","","4.8","7","""Smooth transaction""","Household Equipement"
"Smart Blood Pressure Machine Aneroid Sphygmomanometer BP Apparatus Smart Digit Blood Pressure Monitor"," 49,119","5.0","2","""fast delivery""","Household Equipement"
"Handheld    Atomizer Nebulizador Mesh Nebuliz Portatil Mini Handheld portable Inhale Nebulizer"," 23,898","4.8","22","""Excellent service""","Household Equipement"
"Lastek new inventions cold laser therapi diabetic watch for blood pressure other"," 236,145","4.9","60","""fast delivery""","Household Equipement"
"European standard other    heart rate SpO2 APP finger monitor eos pulse ECG card"," 214,105","","","","Household Equipement"
"New Arrival other    low price blood pressure monitor wrist blood pressure monitor"," 20,089","4.8","33","""Good service""","Household Equipement"
"KJ8C+KJ10C Digital Otoscope OphthalmoscopeOther","","4.9","11","""great service""","Household Equipement"
