"Product Name","Price_TND","Rating","Review count","Review","Category"
"BIOBASE China Wheelchair Home Rehabilitation  Treatment 20 Inches Rear Wheel Wheelchair for Hospital"," 94,458","","","","Rehabilitation Equipement"
"patient care advanced handicapped foldable lightweight folding power electric wheelchair"," 1253,143","5.0","1","","Rehabilitation Equipement"
"BIOBASE portable  Electric Folding and Opening Adjustable Wheelchair","","4.6","6","""professional service""","Rehabilitation Equipement"
"2021 Arfurla  physical therapy laser handle handpieces tools for laser physical therapy","","4.9","34","""amazing service""","Rehabilitation Equipement"
"HOCHEY  801 Ready To Stock Hospital Electric Foldable Wheelchair Factory Price"," 1254,340","","","","Rehabilitation Equipement"
"YB-QZH Multi-function Training"," 4408,040","5.0","8","""good service""","Rehabilitation Equipement"
"Physical Therapy  Shock Wave Rehabilitation Equipment"," 18888,452","","","","Rehabilitation Equipement"
"Inflatable ankle orthosis rehabilitation  shoes"," 180,667","","","","Rehabilitation Equipement"
"Physiotherapy Home Assisted Stroke Hand Exerciser  Hand Finger Rehabilitation Trainer Exercise Robot"," 613,977","4.8","43","""Nice service""","Rehabilitation Equipement"
"hand and foot rehabilitation training instrument foot therapy finger stroke rehabilitation","","4.9","16","""fast service""","Rehabilitation Equipement"
"AFO Foot Drop Orthosis Brace Upgrade  Support"," 23,615","4.9","21","""excellent service""","Rehabilitation Equipement"
"Breathable Heightened Double Airbag  Adjustable Orthopedic Thoracolumbar Brace Rehabilitation Fixed Support"," 68,640","","","","Rehabilitation Equipement"
"Hyperextension brace orthosis lumbar spine orthosis for jewett brace"," 94,458","4.7","47","""on time shipping""","Rehabilitation Equipement"
"Recovery Rehabilitation Adjustable  Orthopedic Hip Abduction Brace Hinged Hip Support Brace For Kids"," 66,121","","","","Rehabilitation Equipement"
"HKJD Physiotherapy Adjustable Orthotics  Post Op Lower Back LSO Brace Support Lumbar Support Orthosis","","4.6","10","","Rehabilitation Equipement"
"Rehabilitation Therapy Equipment Rollator Walker  Mobility Moving Disabled Upright Walker Foldable With Height Adjustable"," 138,539","","","","Rehabilitation Equipement"
"Disposable  Supply Post Surgery Abdominal Compression Band (M)"," 28,338","4.9","6","""Good service""","Rehabilitation Equipement"
"Rehabilitation Therapy Supplies Light Weight  Hospital Home Adjustable Folding Aluminum Alloy Elbow Crutch For Disable"," 8,344","4.8","7","""Smooth transaction""","Rehabilitation Equipement"
"Artificial Limbs Easy Pull Sleeve Prosthetic Leg Products"," 47,229","4.9","28","""good service""","Rehabilitation Equipement"
"Lumbar Support Orthosis Splint Body Jacket Low Temperature Thermoplastic Splints"," 220,402","5.0","3","""Great customer service""","Rehabilitation Equipement"
"MT  Manufacturer Folding Portable Electric Wheelchair Sale"," 1322,412","4.6","19","""good supplier""","Rehabilitation Equipement"
"China Factory Soft Neck Orthopedic  support Soft Foam Neck Brace Adjustable Black Cervical Collars"," 3,149","4.8","18","""quick delivery""","Rehabilitation Equipement"
"Rehabilitation exercise for hand physical therapy training  wrist and finger trainer For Orthosis"," 78,715","4.8","66","""Fast Delivery""","Rehabilitation Equipement"
"VELPEAU Tendonitis Pain Relief Octopus-Shaped Splint Orthopedic  rehabilitation thumb protector"," 48,457","4.7","1","","Rehabilitation Equipement"
"cheap aluminum folding walker adjustable portable walking frame with seat for  Clinic, hospital Children, adults, elderly"," 31,172","4.7","75","""excellent service""","Rehabilitation Equipement"
"Hospital Walking Rehabilitation Equipment Parallel Bars"," 913,094","5.0","15","""Excellent customer service""","Rehabilitation Equipement"
"small wheelchair motorcycle  mobility electric scooter for rehabilitation"," 944,580","5.0","1","","Rehabilitation Equipement"
"Adjustable  HKAFO brace orthosis kafo leg brace Support with lower limb support"," 330,603","4.0","5","""fast delivery""","Rehabilitation Equipement"
"wheel chair brushless motor aluminum foldable electric wheelchair Price sillas ruedas cadeiras de rodas"," 857,679","5.0","5","""good service""","Rehabilitation Equipement"
"Emtt magnetic  machine Extracorporeal Pain relief Massage For Spa Home Magnetic Transduction Therapy"," 6294,052","5.0","21","""excellent service""","Rehabilitation Equipement"
"Hospital Walking Rehabilitation Equipment parallel bars"," 913,094","4.7","7","""fast delivery""","Rehabilitation Equipement"
"Manufacturer Rehab  equipment hand exerciser"," 314,860","","","","Rehabilitation Equipement"
"wheelchairs in kuwait folding wheelchair with CE certificate"," 409,318","","","","Rehabilitation Equipement"
"Walker Foot Drop System Walking Aids for Dropped Foot Patients"," 9,446","","","","Rehabilitation Equipement"
"Chinese Verified Supplier Pressure Relief   Air Bed Mattress With Pump"," 170,025","5.0","29","""good service""","Rehabilitation Equipement"
"aluminium adults disabled elderly seniors upright walker rollator foldable walker frame walking aids"," 34,635","4.8","7","""Smooth transaction""","Rehabilitation Equipement"
"multi function home care  rehabilitation  clinic bed"," 3463,460","4.5","8","""fast shipping""","Rehabilitation Equipement"
"hip knee ankle foot brace orthosis for rewalk"," 330,603","5.0","14","""fast shipping""","Rehabilitation Equipement"
"Hospital use  aluminum crutches for disabled","","","","","Rehabilitation Equipement"
"BIOBASE Walking Aid MF911LA  Walking Aid Aluminum Alloy Frame Walker Hospital Patient Walking Aid Sales Promotion Super","","4.6","15","""Fast delivery""","Rehabilitation Equipement"
"BIOBASE wheelchair home rehabilitation double brake  wheelchair for lab"," 125,944","4.6","8","""good service""","Rehabilitation Equipement"
"Mobility  Equipment Table For Training Rehabilitation"," 34571,628","","","","Rehabilitation Equipement"
"Biobase China Semi-Electric Hospital Bed  Manufacturers Home care beds"," 406,170","4.6","6","""professional service""","Rehabilitation Equipement"
"orthopedic back brace thoracolumbar orthosis"," 266,876","","","","Rehabilitation Equipement"
"2023 Wholesale New Product Comfortable White Black Hand Rehabilitation  Robot"," 469,142","4.8","43","""Nice service""","Rehabilitation Equipement"
"ROM Knee Brace Support for Knee Pain/knee brace for osteoarthritis/knee brace for OA"," 45,498","4.9","21","""excellent service""","Rehabilitation Equipement"
"Supplies Knee Brace Knee joint stabilizer Orthopedic ROM Advance Post Op Knee Brace for rehabilitation"," 46,285","","","","Rehabilitation Equipement"
"TJ-OM007 hemiplegia finger hand rehabilitation  hand rehabilitation robotic exercise","","4.9","16","""fast service""","Rehabilitation Equipement"
"Luxury Upgraded Height Adjustable Orthopedic Thoracolumbar Brace External Fixation Support  Rehabilitation"," 106,423","","","","Rehabilitation Equipement"
"Multi-functional new  Rehabilitation Tools Europe style walking aids equipment for disable and elderly people"," 119,647","","","","Rehabilitation Equipement"
"Disposable  Supply Post Surgery Compression Bra (R)"," 37,784","4.9","6","""Good service""","Rehabilitation Equipement"
"Amazon eBay Hot Selling Cervical Neck Traction Inflatable and  air Cervical vertebra fixed inflatable neck collar","","4.7","47","""on time shipping""","Rehabilitation Equipement"
"Prosthetic raw material 22cm  Casting Elastic Surgical Cotton Stockinette artificial limb leg"," 100,756","4.9","28","""good service""","Rehabilitation Equipement"
"ESWT shockwave  physiotherapy equipment rehabilitation machine"," 5667,480","5.0","8","""good service""","Rehabilitation Equipement"
"Adjustable high quality  post op orthopedic hinged knee immobilizer support brace of Lower limb orthoses"," 330,603","4.0","5","""fast delivery""","Rehabilitation Equipement"
"Health  rehabilitation neck brace cervical collar comfortable collar  neck brace for relieve cervical pain"," 35,233","4.7","1","","Rehabilitation Equipement"
"Rehabilitation training foldable aluminum steel frame  walking aid walkers for disabled Folding Walking Aid for adults"," 31,172","4.7","75","""excellent service""","Rehabilitation Equipement"
"Hospital Physiotherapy Rehabilitation Equipment  Tilt Adjustable Rehabilitation Bed For Disabled"," 5667,480","5.0","15","""Excellent customer service""","Rehabilitation Equipement"
"Foldable Electric Power Patient Lift Hoist  Lift"," 2830,592","","","","Rehabilitation Equipement"
"scooter electric mobility four-wheel folding scooter for the elderly electric mobility transformer scooter"," 1826,188","5.0","1","","Rehabilitation Equipement"
"Factory saleshospital furniture  bedmedical bed boardmedical beds turkey","","","","","Rehabilitation Equipement"
"Hospital cerebral palsy  equipment for Children/ Adult type standing frame for person"," 818,636","4.7","7","""fast delivery""","Rehabilitation Equipement"
"rehabilitation treatment equipment cross trainer for 4 limbs made in China hot sale on line"," 8186,360","5.0","1","","Rehabilitation Equipement"
"Shoulder Posture Protector Wrap Brace Black Shoulder Support With Pump Belt Pain Relief Sport Use"," 11,084","4.8","19","""quick delivery""","Rehabilitation Equipement"
"Remote Control Automatic  Electric Folding And Opening Wheelchair Power Wheel Chair For Disability"," 107,053","5.0","5","""good service""","Rehabilitation Equipement"
"Orthopedic Instruments  Orthotic Rubber Bowl Prosthetic Tools prosthetic Plaster Mixing Bowl"," 9,446","4.8","66","""Fast Delivery""","Rehabilitation Equipement"
"Wholesale Adults Aluminum Disabled  foldable Crutch Walking Stick for Old"," 6,927","4.8","7","""Smooth transaction""","Rehabilitation Equipement"
"MT  Hot Sale Elderly Travelling Wheelchair electric","","4.6","19","""good supplier""","Rehabilitation Equipement"
"walking with under arm crutches for adult","","","","","Rehabilitation Equipement"
"BIOBASE China Walker aluminum alloy one foot portable folding  Walking Stick for disabled elders","","4.6","15","""Fast delivery""","Rehabilitation Equipement"
"BIOBASE Walking Stick In Stock 4 Legs  Rehabilitation Walking Stick for disabled elders old man"," 9,446","4.6","8","""good service""","Rehabilitation Equipement"
"Equipment Rehabilitation Physical Therapy Table"," 34571,628","","","","Rehabilitation Equipement"
"orthopedic lumbar support orthosis lumbar brace"," 467,032","","","","Rehabilitation Equipement"
"Hospital Electric Finger Exercise  Healthcare Multifunctional Stroke Hand Function Rehabilitation Robot Machine"," 613,977","4.8","43","""Nice service""","Rehabilitation Equipement"
"Factory Price Nylon Knee Brace  Knee Joint Protector Adjustable Knee Support"," 46,285","4.9","21","""excellent service""","Rehabilitation Equipement"
"Foldable With Height Adjustable  Rehabilitation Rollator Physical Therapy Training Equipment Walker Rollater"," 132,242","","","","Rehabilitation Equipement"
"Adjustable Orthopedic Stabilizer Reinforced Fixed Belt Walking Strap Non-slip Fixed Knee Joint Fixed Support"," 85,328","","","","Rehabilitation Equipement"
"Adjustable CE  Cervical Neck Collar Cervical Collar Neck Brace For Neck And Shoulder Pain"," 33,061","","","","Rehabilitation Equipement"
"Disposable  Supply Post Surgery Breast Compression Garment Bands (A)"," 28,338","4.9","6","""Good service""","Rehabilitation Equipement"
"Anti Drop +A2:E29Water Resistant Noise Reduction Hearing Loss Seniors Rechargeable Deaf BTE Hearing Aid"," 20,466","4.6","8","""Fast delivery""","Hearing products"
"Machine Digital Ear Amplifier Digital CIC Rechargeable Custom Hearing Aid"," 69,585","","","","Hearing products"
"2022 Newest Low Price Wireless Noise Cancelling Hearing Aids Digital High Quality Rechargeable Elder  Product Amplifier"," 32,431","4.9","19","""good service""","Hearing products"
"Hearing Aid Cofoe BTE New Style   Home  Popular Adjustable Tone Sound Amplifier Hearing Aid"," 21,411","5.0","2","""fast delivery""","Hearing products"
"High Demand The Elderly People Products Hearing Aids    for Amplifier"," 50,063","4.5","15","""Good service""","Hearing products"
"Rechargeable Digital Hearing Aid"," 136,965","5.0","4","""fast delivery""","Hearing products"
"audifonos para sordos BTE hearing aids rechargeable heraing aids for deafness G25L"," 29,912","5.0","6","""good supplier""","Hearing products"
"2021 Hot sales telecoil trimmer earhook hearing aid microphone"," 47,229","4.7","1","","Hearing products"
"100% Natural Beeswax Ear Candle Wax Removal  Ear Cone Canding Ear Candle"," 0,126","5.0","34","""Great purchase""","Hearing products"
"100% Natural Beeswax Hopi Ear Candle Wax Removal  Ear Cone Canding Ear Candle","","4.3","13","""great service""","Hearing products"
"Small Handy 4 Listening Modes Cheap Buy OEM Deaf Hearing Aid"," 34,635","4.1","4","""friendly service""","Hearing products"
"Medical  Ear   Digital Hearing Aid"," 25,000","4.9","8","""smooth transaction""","Hearing products"
"Hot Sale CE   Products Personal Sound Amplifier Rechargeable Hearing Aids"," 136,965","5.0","4","""fast delivery""","Hearing products"
"Hot selling product    Digital Hearing Amplifier High Quality Power Rechargeable New Ear hearing aid audifonos"," 15,114","5.0","5","""good service""","Hearing products"
"Newest design Rechargeable XB-202    electronic hearing aids bluetooth and headphones with 3 pcs Earplug"," 25,126","4.9","32","""fast delivery""","Hearing products"
"New Products 2021 unique Arrival Hot Products Earsmate Portable Hearing Aid For The Deaf    For Japan Market"," 78,684","4.6","11","""Prompt delivery""","Hearing products"
"MY-G057T-18 medical    batteries hearing aid price cheap sale invisible hearing aids for the deaf"," 3,149","4.4","16","""good service""","Hearing products"
"Great-Ears G20B    BTE Hearing Aid Ear Sound Amplifier Headphone for Elderly"," 11,650","5.0","1","""good service""","Hearing products"
"starkey eargo nano widex oticon mini hearing aid amplifier sale noise cancelling low cost bte"," 129,093","4.8","16","""fast service""","Hearing products"
"Digital RIC Hearing Aid Hot Sell Internal Hearing Aids for Hear Disable Person"," 62,972","","","","Hearing products"
"Rechargeable Blue Connect China OTC Signia Hearing Aid Amplifier","","4.9","6","""Good Job""","Hearing products"
"100% Natural Beeswax Hopi Ear Candle Wax Removal  Ear Cone Canding Ear Candle Sticks"," 0,4723","4.8","23","""customer service""","Hearing products"
"Deafness China Hearing   Elderly  Products Electric"," 78,715","4.2","3","","Hearing products"
"medical  ear   bte DSP digital chip hearing aid"," 153,085","5.0","25","""Fast delivery""","Hearing products"
"About Hearing Loss Eldery People Hearing Amplifier Device Mini Sound Hearing Aids","","4.6","68","""Good service""","Hearing products"
"China Suppliers audifonos mini invisible hearing aids for the deaf rechargeable hearing aid isitme cihazi"," 170,025","4.7","75","""excellent service""","Hearing products"
"Ear wax removal candle bewax ear candles fragrance 20cm with stopper    navel candles"," 0,6298","4.5","27","""Quick delivery""","Hearing products"
"China Manufacture Cheap Price Ear Machine Hearing Aid Tinnitus"," 31,486","","","","Hearing products"
"100% Natural Beeswax Hopi Ear Candle Wax Removal  Ear Cone Canding Ear Candle","","4.7","46","""great service""","Hearing products"
"AUSTAR hearing aid    in China Wholesale aparelhos auditivos invisivel hearing aid mould wax filter"," 94,458","4.9","13","","Hearing products"
"other    of buy cheap price of Rechargeable Hearing Aid Amplifier invisible mini hearing aids for deafness"," 47,229","","","""timely delivery""","Hearing products"
"Elderly    Medical Rechargeable Earphone Hearing Aid"," 67,695","5.0","1","","Hearing products"
"Best Selling Medical Hearing Aid Earphone Earplugs Sound Amplifier aid hear For Hearing Loss"," 125,315","4.0","1","","Hearing products"
"for in-ear Mini-Invisible Hearing aids audifonos"," 17,318","4.9","9","""customer service""","Hearing products"
"China    Oem Rechargeable hearing aid Medical For Seniors"," 17,349","5.0","3","","Hearing products"
"hearing aids rechargeable BTE portable mini noise reduction hearing aid"," 308,563","5.0","2","""great service""","Hearing products"
"Min Rechargeable Ear Buy Hearing Aid Digital Amplifier Hearing Appliance"," 440,490","4.9","6","""good service""","Hearing products"
"Rechargeable Digital RIC Hearing Aid"," 812,339","4.4","3","""Great job""","Hearing products"
"Products Listening Devices China BTE Hearing Aid"," 26,291","4.8","4","""great service""","Hearing products"
"medical    Ear & Hearing Products rechargeable bluetooth batteries hearing aids price list"," 73,993","4.8","8","""Good service""","Hearing products"
"Wholesale Ear candle/wax ear candle/beeswax indian ear candle for  .OEM"," 0,9131","4.8","28","""fast shipping""","Hearing products"
"products best product high value rechargeable hearing aids"," 31,172","5.0","1","","Hearing products"
"Wholesale   Hearing Aid Amplifier"," 18,892","","","""Easy transaction""","Hearing products"
"Portable Digital Hearing Aids for the Deaf hearing aid for deafness price"," 9,446","5.0","1","""Nice packaging""","Hearing products"
"Medical  Ear   BTE Digital Hearing Aid"," 223,520","","","""Excellent service""","Hearing products"
"Pure Beeswax Indian Ear Candle for salon"," 2,677","","","""On time shipping""","Hearing products"
"Factory  Rechargeable Economical In The Ear Hearing Aids Sound Amplifier Aid waterproof Color Beige aid"," 11,556","4.5","14","""good service""","Hearing products"
"Elderly  Food grade Approved Medical Equipment resound hearing aid ear tip China Bte Hearing Aid Ear Plugs"," 0,0315","4.7","2","","Hearing products"
"Hearing Loop Device WDRC Digital Hearing Aid Ear Aids"," 122,796","5.0","4","""fast delivery""","Hearing products"
"New type hot sale    hearing aid devices digital ear aids for the deaf audifonos medicados digitales","","4.7","75","""excellent service""","Hearing products"
"Quality Hearing aid Amplifier Rechargeable Hearing Aid Wireless Phone Call Hearing Aid"," 314,231","4.0","1","","Hearing products"
"high quality digital programmable rechargeable hearing aid app control"," 729,752","5.0","2","""great service""","Hearing products"
"Trending Products 2021 New Arrivals   Rechargeable BT Hearing Aid Amplifier"," 28,338","4.9","6","""Good Job""","Hearing products"
"Machine Digital Ear Amplifier 10 channels Rechargeable Custom Hearing Aid"," 182,619","5.0","2","","Hearing products"
"China Very popular ear & hearing products hearing aid ear aids audifonos medicados Other Healthcare"," 9,068","5.0","5","""good service""","Hearing products"
"Factory Direct Selling Popular Hearing Aid 10 Cell   Products Comfortable"," 724,178","","","","Hearing products"
"Best Selling Cheap BTE Hearing Amplifier Manufacturer Rechargeable    Hearing Aid for Seniors Audifonos","","5.0","1","","Hearing products"
"Custom Best Ear Hearing Aid Prices Elderly Assistive Listening Device Hearing Loss  Products"," 11,021","4.2","3","","Hearing products"
"Portable Mini In The Ear Invisible Sound Amplifier Adjustable Tone Digital Hearing Aid Rechargeable For The Deaf","","","","","Hearing products"
"High Value Comfortable Hearing Products Adjustable Volume and Programs Deafness   Equipment"," 141,687","4.8","8","""good service""","Hearing products"
"Fragrance Ear Wax Remover Candle Fragrance Wax Hopi Candle with Tube For"," 0,5668","5.0","1","""customer service""","Hearing products"
"other Healthcare  of Amplifier invisible hearing aid mini hearing aid with MDR CE certificate from China manufacturer"," 80,290","","","""timely delivery""","Hearing products"
"Wholesale Healthcare  Deaf ITE Small Analog Magnetic Charging Sound Amplifier Hearing Aid","","","","","Hearing products"
"Cheaper Hearing Aids Usb Charging Port Hearing Loss   Mini Portable Aids For Deafness"," 68,010","4.8","7","""Smooth transaction""","Hearing products"
"Aparelhos auditivos Rechargeable Hearing Loss Intelligent Denoising Digital Hearing Aid For Deaf Deafness"," 189,011","4.6","8","""Fast delivery""","Hearing products"
"New Arrival Low Cost Digital Rechargeable Hearing Amplifier for the deaf invisible prices ear hearing aid"," 59,509","4.5","15","""Good service""","Hearing products"
"Rechargeable Blue tooth BT Hearing Aid nano hearing aids G25BT"," 42,507","5.0","6","""good supplier""","Hearing products"
"BTE Ear Aids Sound Amplifier Deaf Hearing Earphone For Adults Great-Ears G20"," 11,021","5.0","1","""good service""","Hearing products"
"Ear Hearing Products Wireless Earphones Hearing Aids For Deafs"," 157,430","4.8","8","""On time shipping""","Hearing products"
"Hot selling product    Digital Hearing Amplifier High Quality Power Rechargeable New Ear hearing aid audifonos"," 28,338","4.6","37","""excellent service""","Hearing products"
"factory Wholesale Psap Rechargeable App Hearing Aid Digital Ear Aid Sound Amplifier For Hearing Loss"," 125,315","4.0","1","","Hearing products"
"Ear Amplifier For   to sell online Innovative Unique products 2021"," 100,756","4.2","14","""Received on time""","Hearing products"
"China hear amplifier 90dB 4 Channels Cheap    hearing aids BTE aid for seniors of Spieth"," 154,282","5.0","2","""great service""","Hearing products"
"Wholesale Audifono Para Sordera Aid Auditive Blue tooth Rechargeable   Product"," 62,972","4.9","6","""Good Job""","Hearing products"
"products hearing aid best BTE analog rechargeable sound amplifier"," 25,189","","","","Hearing products"
"Hot sale   products bte personal sound amplifier rechargeable digital hearing aids","","5.0","1","","Hearing products"
"ODM/OEM   Products New Intelligent New Style TWS ITE Hearing Aid Rechargeable Elderly Rehabilitation Therapy","","4.5","15","""Good service""","Hearing products"
"High quality cheap hearing aids    hearing aids rechargeable amplifier bluetooth wireless hearing aid for deaf"," 37,469","4.9","5","","Hearing products"
"Great-Ears G17 Manufacture    Hearing Aid For Hearing Loss elderly"," 29,912","5.0","1","""good service""","Hearing products"
"Medical  Ear   Wholesaler Digital BTE Hearing Aid"," 122,796","4.9","6","""good service""","Hearing products"
"Portable Mini In Ear Invisible Sound Amplifier Adjustable Tone Digital Hearing Aid Rechargeable for Deaf"," 17,318","4.7","75","""excellent service""","Hearing products"
"Digital BT BTE Hearing Aid Gio 402BT Retone New Design Digital Mini Amp Hearing Aid 9021400000 Adjustable"," 239,294","4.2","14","""Received on time""","Hearing products"
"China    Oem Hearing Aid Earbuds Hearing Rechargeable Aids Digital Medical Hearing Aids For Seniors On Tv"," 173,173","","","","Hearing products"
"2021 best selling battery New amazon popular   product ear sound amplifier hearing aid"," 78,715","5.0","2","""great service""","Hearing products"
"Voraiya   Suppliers G400 Amazon Sells OTC Old Man Hearing Aid Earphone"," 65,177","4.6","8","""Fast delivery""","Hearing products"
"Aroma therapy products ear wax candles 15cm with stopper belly botton wax candle for","","4.3","13","""great service""","Hearing products"
"New Product Wholesales Medical hearing aids rechargeable noise reduction behind ear   digital hearing aid for deafness"," 43,042","4.8","4","","Hearing products"
"8 channels processing 3 Program No Whistle Hearing Aid Non-programmable   Products"," 88,161","4.6","9","""Arrived quickly""","Hearing products"
"2020 New  Economical hearing amplifier  Digital Hearing Amplification for the deaf Accessories BTE Ear Hearing Aid"," 13,288","4.5","14","""good service""","Hearing products"
"Set Package Popular Product   indian Hopi Ear Candle Remove Earwax ear candle"," 0,3779","","","","Hearing products"
"F-998B Deafness Sound Amplifier Best Selling   Products For Elderly Healthcare Tools Products"," 78,715","4.2","3","","Hearing products"
"Hot sale newest product 100% natural   bee wax ear candles for ear cleaning OEM ODM DDP"," 0,7872","5.0","55","""Fast shipment""","Hearing products"
"New Trending   Product Jinghao CE ISO CIC Invisible Mini Hearing Aids"," 47,229","4.9","6","""good service""","Hearing products"
"Indian Ear Candle   Product 100% Natural Beeswax Ear Wax Removal Candle"," 5,668","5.0","27","""customer service""","Hearing products"
"Best price Hearing aid cleaning brush with magnet and loop   product audfonos hearing aid accessories"," 0,6298","5.0","20","""Great supplier""","Hearing products"
"Hodaf Tray Fragrance Aromatherapy   Ear Wax Removal Ear Treatment Indiana Candling Ear Candle"," 0,3149","","","","Hearing products"
"Newly designed ITE Hearing Aids Rechargeable Digital Ear   Amplifier for Deafness Analogue Hearing Aids Manufacture","","","","","Hearing products"
"Wireless Aids Rechargeable Hearing Loss Intelligent Denoising Digital Hearing Aid For Deaf Deafness"," 189,011","4.6","8","""Fast delivery""","Hearing products"
"Medical Device Rechargeable Digital Hearing Aid Portable Wireless Ear Amplifier    for Elders Deafness People"," 132,871","4.5","15","""Good service""","Hearing products"
"Hearing aid Hearing amplifier Battery audifonos para sordos    G10"," 12,595","5.0","6","""good supplier""","Hearing products"
"Retone 2021 Digital BTE hearing aid 2 Channels WDRC amplifier microphone Hot Selling"," 47,229","4.7","1","","Hearing products"
"New Products Earphone for the Deaf Price Rechargeable Charging Case Hearing Aid G12X"," 29,912","5.0","1","""good service""","Hearing products"
"JINGHAO Medical  Ear   Rechargeable Digital Hearing Aid"," 136,965","5.0","4","""fast delivery""","Hearing products"
"Morden Style    Trending Product 2022 New Arrival Hearing Aid"," 20,466","4.9","6","""Good Job""","Hearing products"
