"Product Name","Price_TND"
"Iboolo Handheld 10X Dermatoscope With Ce Certified","694.61"
"Portable Diathermy Machine High Frequency Electrosurgical Cutter Cautery Unit","3157.30"
"Probe Reduction Forceps Surgical Basic Instrument Tool","15.79"
"Surgical Instruments Hot Sale Surgical Electrosurgical Disposable Esu Pencil Supplier","0.32"
"Multi-Purpose Diagnostic Set Applications Otoscope Ophthalmoscope Diagnostic","126.29"
"Suppliers Disposable Surgical 55W Skin Stapler Acos Skin Stapler Automatic Skin Stapler","5.05"
"Disposable Skin Stapler 35W Surgical Staples","4.89"
"Multi-Purpose Diagnostic Set Applications Otoscope Ophthalmoscope Diagnostic","126.29"
"Male Circumcision Stapler Visual Disposable Circumcision","59.99"
"90W Urology Surgical Instruments Ureter Stricture Vaginal Treatment Holmium Laser Prostate","91561.70"
"Pusm Surgical Instruments Retractor","63.15"
"Veterinary High Frequency Unit High Frequency Unit","1736.52"
"Cl40E Co2 Laser Surgical Equipment Ent Disease Treatment","78932.50"
"Laparoscopic Simulator /Trainer Box For Students Training Instruments","236.80"
"Surgical Elastomeric Ring Rubber Band Anal Hemorrhoid Ligation For Hemorrhoids Treatment Surgery","31.57"
"2022 Full Hd Endoscopy Camera With Screen Endoscope Cameras Laparoscopy Urology Surgery Equipment","6314.60"
"Lipo Laser Lipolysis Equipment Body Shaping Laser With Ce 980Nm Diode Laser","18943.80"
"Multi-Purpose Diagnostic Set Applications Otoscope Ophthalmoscope Diagnostic","126.29"
"Iris Scissor General Surgery Scissor Orthopedic Instruments Dental Tools House Of General Surgery","2.53"
"Quality Reliable And With Nice Performance Endoscope Disposable Video Laryngoscope For Adult Vls-Il","944.03"
"Icu Anesthesia Portable Electronic Digital Diagnostic Video Laryngoscope","3157.30"
"Dp-Ge50 Smoke Evacuator","2683.70"
"Obstetrical Forceps Surgical And Gynecology Instruments Manufacturer","9.44"
"Wholesale Price Cusco Vaginal Speculum Gynecology Cusco Speculum","9.47"
"Hot Sale Factory High Quality Pph Tst Hemorrhoid Stapler Anastomosis","94.72"
"Dts-3000 Easy Checking And Cleaning Upgraded Version Reliable Safety Products","11997.74"
"Otoscope Custom Color Mini Fiber Optic Otoscope For Ear Eye Throat Diagnostic","28.42"
"Supply Disposable Circumcision Stapler Male Circumcision","47.99"
"Free Design Japanese Piercing Oem Parts Surgical Micro Forceps","4.74"
"Surgical Instruments Cyclodialysis Spatula At Lowest Price Cyclodialysis Spatula","21.47"
"Ent Instruments Mini Otoscope Fiber Optic For Diagnostic Examination","15.76"
"Yd-335A Commercial Equipment Clinical Analysis Instrument Semi Automatic Rotary Microtome","5367.41"
"Medicla Esd-Kwb5 Medicla Hospital Lab Clinic Wbc Leukocyte Analysis Blood Analysis System Portable Wbc White Blood Cell Analyzer","1941.74"
"Simple Innovative Products Efficient Performance Commercial Automated Blood Coagulation Analyzer","2178.54"
"Affordable Analyzer Ce Certified Portable Semi-Auto Electrolyte Analyzer Provider","2841.57"
"Lab Equipment Real Time Pcr Clinical Analytical Instruments Qpcr Price","44202.20"
"China Made 7 In 1 Blood Testing Dry Biochemical Blood Lipid Hemoglobin Analysis Meter","649.457"
"Dymind Dh26 Hematology Analyzer 3 Part Cbc Hematology Analyzer Blood Testing Equipments","7258.633"
"China Hitachi Automatic Analysis Vertical Auto Chemistry Analyzer","19890.99"
"Cms6600B Four-Channel Electromygram Eeg Ep System Electromyography Emg Equipment","6721.892"
"Vivo Light Portable Vein Finder Vein Viewer Clinical Analytical Instruments","944.033"
"Handheld Vein Viewer /Vein Detector Price","944.033"
"Handheld Ce Infrared Vein Finder","6516.668"
"Roundfin Rd-315 Clinical Analytical Instruments Rotary Hand Price Manual Freezing Tiuuse Microtome","8524.71"
"Lansionbio Analyzer Diagnostic Immunoassay Quantitative Analyzer Poct Ls-4000","3157.3"
"High Precision Veterinary Hematology Analyzer Pet Clinical Analytical Instrument Gm-Hr800C","6630.33"
"Handheld Vein Viewer /Vein Detector Price","2525.84"
"Bpm-U300 Sediment Price Albumin Creatinine Urine Chemistry Analyzer","1578.65"
"Grade Quantum Magnetic Resonance Quantum Therapy Analyzer","151.551"
"Supplies Red Light Led Veinfinder Infrared Vein Finder","56.832"
"Manufacturer Portable Handheld Vein Viewer Vein Detector","1578.65"
"Physical Therapy Equipments Biophilia Intruder Oximeters Pulse","4420.22"
"Biostellar Hospital Visual Vein Finder Use In Hospital And Help Nurse Inject For Patient Vein Locator","66.304"
"Sysmex Automatic Xs-1000I Blood Cell Analyzer Clinical Instruments","18943.8"
"Portable Electromyogram Emg Ep Machine Emg Price With Nerve And Muscle Stimulator","5998.87"
"Pediatric Blood Vessel Locator And Displaying Vein Map Directly On Skin","5209.545"
"2021 Best Instruments Vein Finder Portable Infrared Vein Finder","221.011"
"Sy-G090T Portable Infrared Vein Viewer Vein Finder","625.146"
"Hot Sale Ce Infrared Vein Finder 7 Colors Available Portable Vein Finder","2999.435"
"Vidas Reagents - Biomerieux Reagents Top Brand Clinical Analytical Instruments -","31.573"
"Factory Manufacture Automatic Nucleic Acid Extractor","17365.15"
"Infrared Handheld Finger Vein Scanner, Arm Vein Finder , Hospital","6156.735"
"New! Height Weight Health Checkup Full Body Diagnosis Test","11366.28"
"Blood Vessel Finder With Ce Certificate","631.46"
"Biobase China Hot Sale Vein Finder Bkvd-1201M Body Venipuncture In Stock Lcd Display For Clinical And","4735.95"
"Infrared Vein Finder Detector Vein Imaging Compact","86.826"
"Portable Mslvt30 Equipment Vein Viewer Infrared Vein Finder","2102.762"
"Getein 1160 Poct Oem Portable Multiple Channels Immunoassay Analyzer Clinical Analytical Instrument","2525.84"
"Handheld Iv Vein Artery Finder Red Light Infrared Vein Finder /Detector/Viwer/System/Machine","3157.3"
"Biobase China Portable Infrared Vein Finder Vein Imaging For Injection","3473.03"
"Cheaper Price Vein Finder Handheld For School Lab Vein Imaging System Doctors Nurses Vein Viewer Illumination","4613.447"
"Portable Vein Finder Portable Adult Transilluminator Rechargeable Vein Finder Vein Detector","56.832"
"Hot-Selling Equipment Visual Display Body Facial Vein Finder Hospital For Hospital Use","2522.683"
"Portable Automatic Urine Test Strips Analyzer For Hospital Ck-60 Health Clinical Laboratory Diagnostic Chemistry","1768.088"
"High Performance Digital 12 Channel 12 Lead Ecg/Ekg Machine Electrocardiograph Hospital","4104.49"
"Huali First Aid Trauma Kit Supplies Special Style Shipped Within 15 Days First Aid Kit","3.126"
"Hospital Portable Emergency Equipment 7 Inch Screen 5-Lead Ecg Defibrillator","5304.264"
"Operation Table Manufacturers Hot Selling Or Operating Table/ Equipments/Hospital Instruments","14299.412"
"Latex Free Elastic Disposable Tourniquet","0.1263"
"First Aid Spinning Pre-Hospital Life Saving Hemorrhage Control Application Rescue Blood Tourniquet","5.242"
"First Aid Supplies Amazon Good Price And Design Mini Individual Travel First Aid Kit Full Household First Aid Kit With Supplies","7.894"
"First Aid Kit With Emergency Supplies For Outdoor Survival Use","3.789"
"Fast Response Defibrillator Aed Rescue Kit","7.894"
"Equipment Defi8 Defibrillator Monitor Heart Shock With Ecg Monitor","4417.063"
"Manufacturing Waterproof Military Tactical Backpack Emergency Rescue First Aid","10.104"
"Equipment Breathing Mouth Adult Hard Case Cpr Mask First Aid Cpr Mask With One Valve","3.631"
"Hf-8000A Automated External Defibrillator Equipmentemergency Supplies & Training","3946.625"
"2022 Manufacture Hot Sale First-Aid Travel Abs First-Aid Bags","9.472"
"Portable Infant Resuscitator Pigeon T Piece Neopuff Temporary Breathing","3157.3"
"Icu Bridge Electrical Ot Pendant Bridge For Supplies","2210.11"
"Good Price Wrap Tape Orthopedic Fiberglass Splint For Wound Dressing","4.105"
"Defi8 Defibrillator Monitor Heart Shock With Ecg Monitor","8840.44"
"Wholesale Portable First Aid Light Weight Folding Scoop Stretcher With Straps","221.011"
"Oem Emergency Survival Kit Box Metal First Aid Kit First-Aid","128.66"
"Abs Elastic Compression Adjustable Tourniquet Band With Buckle","0.0316"
"Semi-Automatic And Manual Aed Defibrillator For Ambulance","4735.95"
"Rescue Breathing Cpr Bag For Emergency Situation","182.429"
"Portable Ecg High Quality Ecg 6 Channel Ecg For Hospital And Clinic","1531.291"
"Huali Manufacture Ifak Tactical First Aid Kit","7.199"
"Ebola Negative Pressure Isolation Chamber Stretcher","10513.809"
"Outdoor Camping 31 In 1 Emergency Supplies First Aid Case Waterproof First-Aid Box Portable Trauma Kit","28.732"
"Aspirator Body Electric Vacuum Suction Machine","378.876"
"Manufacturing Customized Waterproof Aluminum First Aid Case","15.787"
"Defi8 Defibrillator Monitor Heart Shock With Ecg Monitor","8208.98"
"Oem Customized Pvc With Equipment Products Kits 200 300 Piece Box First Aid Kit","18.944"
"Biphasic Low Energy Aed Defibrillator 50J For Kids 150J Aed Automated External Defibrillator","2683.705"
"Manufacture Multiparameter Monitor","1326.066"
"Ready To Ship First Aid Disposable Manual Surgical Pneumatic Tourniquet Cuffemergency Medi","94.719"
"Portable Cardiac Defibrillator Monitor Heart Shock With Ecg Monitor","8840.44"
"Best Selling Functional Tourniquet Tpe Es March Bandage","0.0632"
"Outdoor Adventure Equipment Design Outdoor Emergency Trauma Kit","27.153"
"Hot Selling Waterproof Rescue Large First Aid Kit Bags","31.573"
"First Aid Kits In The Company'S Family","160.328"
"Ce Approval China Defi8 Defibrillator Monitor Heart Shock With Ecg.Spo2.Nibp.Resp.Pr.Temp","8208.98"
"Equipment Breathing Mouth Adult Hard Case Cpr Mask First Aid Cpr Mask With One Valve","3.158"
"Biphasic Low Energy Aed Defibrillator 150J Universal Aed Automated External Defibrillators","2494.267"
"Manual Tourniquet Medicalemergency Supplies & Training","11.051"
"Self Testing Lh Ovulation Test Diagnostic Test Kits Lh Ovulation Rapid Test Colloidal Gold Ovulation Predictor Complete Starter Kit","0.1263"
"Single Use Vaginal Speculum Dilator Set Disposable With Middle Screw","0.3884"
"Manufacture Disposable Plastic Cusco Speculum","1.895"
"Deepblue Rapid 1 Step Fecal Occult Blood Diagnostic Test Kit Tumor Marker Test Kit With Ce","0.7894"
"Manufacturer Cheap Price Various Size Disposable Sterile Light Source Vaginal Speculum Dilator","0.4168"
"High Quality Curette Biopsy Endometrial At Best Price","18.313"
"Production Of Sterile And Painless Speculum For Disposable Vaginal Examination","0.7894"
"Manufacturing Of Sterile Automatic Rotary Sampling Gun","1105.055"
"Factory Non-Toxic Non-Irritating Sterile Disposable L,M,S Polymer Materials Speculum Vaginal With Screw","0.3158"
"Manufacturing Of Rechargeable Surgical Lights For Hospitals","8.841"
"2022 Ireland Supply Infant Care Equipment For Warm Keeping","6314.6"
"Vaginal Speculum Low Price","0.3789"
"Sterile And Specimen Manufacturing And Storage Disposable Virus Collection Swabs","0.4736"
"Large Animal Vaginal Speculum Low Price","0.3884"
"Hot Selling Manufacturing Electric Stent Gynecological Colposcope Operating Table","694.606"
"Children Vaginal Speculum Sizes Low Price","0.3884"
"Factory Transparent Nontoxic Aseptic L,M,S,Xs,Xxs Size Vaginal Speculum Vaginal Dilator Set","0.3884"
"Vaginal Speculum/ Dilator French Type Vaginal Speculum","0.3884"
"Hot Selling 16G,18G,19G,20G,21G,22G,23G,24G,25G,26G,27G,28G,29G,30G Syringe 1Ml Needles 25 G X 1","0.3158"
"Good Quality Manufacturer Cheap Prices Sterile Hypodermic Needles For Syringe Use 16G,18G,19G,20G,21G,22G,23G,24G,25G,27G,30G","0.3158"
"Wholesale Lumbar Disc Support Fracture Rehabilitation Belt Breathable Elastic Waist Support","18.629"
"Two Crank Bed 2 Function Hospital Bed Nursing Bed For Patients","284.157"
"Hospital Manual Bed Hot Sale Adjustable Hospital Bed Equipment Furniture Abs Double-Crank Manual Bed","631.46"
"Hospital Head Foot Board Distributor Bed Accessories Bed Panel System","54.906"
"Multi Functional Electric Icu Bed High Quality Hospital Patient Bed","694.606"
"Multi-Function Electric Intensive Care Hospital Bed Stainless Steel Adjustable Patient Clinic Bed","741.966"
"Hospital Beds Price Home Use Multi-Function 5 Functions Hospital Electric Beds For The Elderly","1420.785"
"Factory Wholesale Transport Stretcher Transfer Trolley Hospital Bed","1199.774"
"Thickened Steel Material Lumbar Spine Rehabilitation Traction Bed Multifunctional Traction Bed Body Stretch Bed","186.281"
"Mobile Laptop Cart Hospital Trolley With 360 Degree Rotation Wheels","56.2"
"Made Different Types Of Gas Outlet Gas Terminal","63.146"
"Bca-132 1 Crank Hospital Bed Produced By Meiisun, A Manufacturer In Shanghai","378.876"
"Biobase China Punching Double-Crank Hospital Bed For Hospital Patient","568.31"
"S336 Kareway Hospital And Center Bed Manufacturer Hospital Bed","1736.52"
"Biobase Hot Selling $11 Super Discount Mf201S Hospital Patient Use Punching Double-Crank Hospital Bed","315.73"
"2 Crank Hospital Bed Produced By Meiisun, A Manufacturer In Foshan","457.809"
"Factory Production Bakcrest Patient Transfer Manual Connecting Transfer Stretcher For Operation Room","4031.873"
"Manufacturer Supply 3 Crank Nursing Manual Hospital Beds","407.292"
"Supply Accept Custom Two Functions Hospital Treatment Bed","1420.785"
"Where Can Buy Multifunction Standing Hospital Bed","6311.443"
"High Quality Abs Mobile Cart Hospital Patient Silent Wheels Nursing Treatment Emergency Trolley With Drawers","710.393"
"Factory Direct Sale Manufacturer Durable Hospital Bed","205.225"
"2 Crank Manual Two Functions Bed","631.46"
"High Efficiency Abs Manual Bed Elderly Patient Hospital Bed For Sale","1231.347"
"Supply Exporters Oem Odm Equipment Aluminium Alloy Guard Bar Electric Hospital Bed","1262.92"
"Manufacturer Bedside Service System Equipment With High Standard Bedside Unit","44.203"
"Comfortable Portable Examination Couch Hospital Hydraulic Bed & Couch Supplies From India","884.044"
"Hot Sale Instrument Sprain Shoulder Abduction Orthosis Brace","94.719"
"Biobase China Hospital Bed Punching Single-Crank Bedside Cabinet Rehabilitation Assistance","473.595"
"Advanced Folding Rehabilitation Equipment Carbon Steel Traction Bed For The Treatment Of Cervical And Lumbar Spine","186.281"
"Wholesale Economic 2 Crank Patient Clinic Manual Hospital Bed For Sick","176.809"
"Supply Sales Oem Odm Luxury Equipment Electric Adjustable Hospital Bed For Health Care","1420.785"
"Electric Disabled Elderly Hospital Home Care Hospital Patient Bed Multifunctional Nursing Bed","1010.336"
"Latest Quality Pre - Treated Plain Examination Couch Table Furniture Wholesaler From India","205.225"
"Biobase Hot Selling Hospital Bed Punching Single-Crank Bedside Cabinet Rehabilitation Assistance","315.73"
"Supplier One Crank Patient Metal Manual Hospital Bed","233.641"
"Supply Exporters Long Service Life Electric Nursing Home Care Hospital Bed","1357.639"
"Quality Assurance Hospital Semi Fowler Bed Electric Top Selling Hospital Furniture / Hospital Beds Supply In India","884.044"
"Biobase Hot Selling Hospital Bed Mf103S High Quality And Durable Slatted Single-Crank Hospital Bed","157.865"
"Biobase Hospital Bed Mf201S Hospital Patient Use Punching Double-Crank Hospital Bed Sales Promotion Super","312.573"
"S Biobase Hospital Bed Mf201S Hospital Patient Use Punching Double-Crank Hospital Bed","312.573"
"Eu-Tb503 Physiotherapy Equipment Lumbar Cervical Traction Treatment Table Traction Bed","3788.76"
"High Quality Intelligent Infusion System En-V7 Stackable Infusion Pump","1562.864"
"Original Factory Hospital Use Gas Outlets Chemetron","47.36"
"Buy Elderly Nurse Call System For Sale Pendant Nurse Call Price","15786.5"
"Vacuum Regulator With Suction Bottle For Hospital Use Vacuum Suction","63.146"
"Customized Nurse Call System Hospital Gas Bed Head Unit Metal Led Customized- 1-6M Oxygen Supply System","1259.763"
"Manufactured Air Outlet Gas Terminal","13.577"
"Hemodialysis Hm-2028M Hospital Patient Hemodialysis Equipment","30938.383"
"Made Different Types Of Gas Outlet Gas Terminal","47.36"
"Convenient Manual Wheelchair With Toilet Rehabilitation","110.999"
"Union Hot Selling Single Channel Electric Syringe Pump","884.044"
"Equipment Infusion Stand Base Three/Four/Five Claw Base","10.735"
"Hospital Wards Bed Head Unit With Gas Outlet","142.079"
"Hot Sale Buoy Type Regulator Oxygen Flow Meter For Hospital Or Clinic Use","47.36"
"Meditech Automatic Folding Cervical And Lumbar Bed Orthopedic Traction Stretcher Bed Mt-P048","173.652"
"Alibaba Adjustable Exam Table","631.46"
"Automatic 3 Function Bed Square Abs Head Board For Paralyzed","947.19"
"Aluminum Alloy Bed Head Unit For Hospital","142.079"
"Training Bed Series Manual Vertical Patient Bed And Rehabilitation Equipment","1891.223"
"Rehabilitation Therapy Supplier G5 Functional Aluminum Wheelchair","530.427"
"High Demand Products Manual Standard Steel Style Ergonomic Manual Wheelchair In Rehabilitation Therapy Supplies","205.225"
"Rehabilitation Therapy Supplier G5 Functional Aluminum Light Weight Manual Wheelchair","520.955"
"Export Quality Products Aluminum Lightweight Wheelchair And Wheelchair Cushion In Rehabilitation Therapy Supplies","419.921"
"Rehabilitation Equipment Carbon Steel Durable Traditional Wheelchair","3.158"
"Rehabilitation Equipment Ventilate Strong China Supplier Wheelchair","3.158"
"Rehabilitation Hospital Nursing Home Adjustable 5 Functional Manual Hospital Wheelchair Beds","1070.325"
"Hot Sell Steel Manual Standard Wheelchair","230.483"
"Standard Steel Transport Manual Wheelchair In Rehabilitation Therapy Supplies Hot Hot Sell","3.158"
"2019 Hot Sell Aluminum Foldable Power Wheelchair With Motor Controller Electric Wheelchair","2494.267"
"Aluminum Reclining Wheelchair Rehabilitation Therapy Supplies And Multifunction Wheelchair","3.158"
"Electric Patient Hoist Patient Lift With Ce","1310.28"
"Steel Manual Commode Wheelchair For Disabled Gaf-01809","110.506"
"2-Section Electric Elevating Pelvic Chiropractic Bed","1578.65"
"Icu Room Electric 3 Function Hospital Bed With 6 Folding Stainless Rails","947.19"
"Electric Hospital Bed Folding Side Rails Stainless Material Hospital Bed","947.19"
"Cheap Price China Manufacturer Direct Sale Function 3 Electric Hospital Bed","947.19"
"Abs Head Board Hospital Basic 2 Cranks Hospital Bed For Disabled","198.595"
"Hot Sale 2 Function Hospital Bed With 4 Noiseless Casters Movable Bed","198.595"
"Elderly Home Nursing Multi-Functional Hospital Bed With Wooden Dinning Table","715.326"
"45 Width Seat Wheelchair Comfortable Adult Wheelchair China Manufacturer","131.72"
"Portable Dental Xray Unit Machine For Dental X Ray Sensor","1894.38"
"Profession High End Hospital Instruments X Ray Equipment Profession Digital High Frequency Mobile Photographic X-Ray Machine","9471.9"
"Bojin Instrument Portable Fluoroscopy Low Dose X-Ray Machine Bji-2J2","4735.95"
"Minimally Invasive Interventional Surgery Manual Bone Drill Machine","277.843"
"High Safety Portable X Ray Machine High Frequency Portable X-Ray Equipment","5051.68"
"X-Ray Equipments Accessories High Frequency Hospital 4Kw Digital Portable X Ray System","7577.52"
"Digital X-Ray Machine Prices Factory Price 630Ma Dr Xray Equipment Digital Radiography System 50Kw X-Ray Machine","25258.4"
"Pld9000A Hf X Ray Machine Equipment","3157.3"
"High Frequency Digital Fluoroscopy Mobile C Arm X Ray Machine","146498.72"
"Green Laser Line Movable Support Bracket Positioning Gauge","15780.186"
"High Demand Import Products Safety Grade Commercial Diagnostic X-Ray Machine","11050.55"
"Chinese X Ray Film Digitizer Scanner With Report Functions For Sale","3157.3"
"Japan X-Ray Imaging Thermal Film Di-Hl 14X17"" (35X43Cm)","1499.718"
"High Frequency Dental X Ray Unit Portable Dental X Ray Machine With Digital Sensor","1578.65"
"Movable Support Aluminum Alloy Bracket Positioning","15780.186"
"Latest Innovative Products Grade Cost Effective Commercial Diagnostic X-Ray Machine","7893.25"
"Handheld Rechargeable Multifunction Power Tool Mini Drill Bone","372.562"
"Handheld Rechargeable Bone Drill Set For Cancer Treatment","372.562"
"Fuji Drypix Use Clear Film Agfa X Ray Film 14X17 For Hospital Cr, Dr, Ct Equipment","1.042"
"Cbct Dental X-Ray Tomographic System Cone Beam Ct Scan Dental X Ray Machine","126292"
"Digital Portable Dental X Ray Machine With Good Price","2519.526"
"Cbct Dental X-Ray Unit System Cbct Scan Dental X Ray Machine For Sale Dental Product 2022 New Style Dental Machine","126292"
"Unit Of X-Ray Mslhx06","25258.4"
"100Mm Lumbar Sternal Abdominal Cavity Puncture Needles","1572.336"
"Hospital Instrument Xray Bji-2J","22101.1"
"Movable Bracket Arbitrary Spatial Location Positioning Support Gauge","25252.086"
"Stainless Steel Aluminum Alloy Movable Bracket Positioning Support Gauge","25252.086"
"In-D4343A Clinic Wireless Xray Detector For Vet Use","56831.4"
"S-Type Head-Neck-Shoulder Thermoplastic Mask For Radiotherapy Fixation System With Iso/Ce","88.405"
"Rehabilitation Finger Orthosis Orthopedic Splint Finger Splint For Finger Protect Posture Corrector","17.366"
"Heating And Magnetic Vibrator Therapeutic Equipment Rehabilitation Equipment For Hospital","1578.65"
"My-A003C Ultrasound Instruments Various Probes Ultrasound Machine","2914.188"
"Prostate Cancer Treatment Radioactive Seed Implant For Cancer Treatment","1572.336"
"Reinforce S-Type Head-Neck-Shoulder Thermoplastic Mask For Radiotherapy Positioning System","94.719"
"Physical Therapy Equipments Grade 5-Liter Oxygen Machine","947.19"
"Infrared Therapy Lamp For Pain Infrared Lamp For Body Care And Physical Therapy Efficient For Waist Pain Relieve","50.517"
"Oxygen-Concentrator 10L 110V 220V 50Hz 60Hz Portable Super Silent Oxygen-Concentrator 10L With 15L Flow Meter","1736.515"
"Bone Laser 25Wpain Laser","10523.281"
"Medris Ready Stock To Deliver Commercial 96% Purity O2 Generator Machin Hospital Oxygen Concentrator With Nebulizer","505.168"
"Orthopedic Thermoplastic Splint Sheet","63.146"
"Hot Sale High Quality 3L 5L 10L Oxygen Concentrator For And Home Use","789.325"
"Physical Therapy Pads Equipments Defibrillation Electrodes For Defibrillator Adult","25.259"
"Factory Oem Health","118.431"
"High Flow Nasal Cannula Oxygen Concentrator 5 Liter","884.044"
"Tens Unit Electrical Nerve Stimulator","51.97"
"Hydraulic Pressure Lumbar Traction ,Back Support Lumbar Traction","299.944"
"Pain Relief Focused Extracorporeal Shockwave Therapy Machine","1796.504"
"Top Manufacturer Pain Relief Physiotherapy Equipment Rehabilitation Machine Multifunction Laser Therapy","186.281"
"Chinese Sale Innovative Smart Wireless Electronic Health Therapeutic Infrared Irradiator Machine","336.095"
"Manufacturers","1259.763"
"Rehabilitation Therapy Laser","2210.11"
"650Nm 808Nm Red Light Handheld Low Level Laser Pain Relief Cold Laser Therapy","236.798"
"Tens Unit Ems Machine Pain Relief Muscle Stimulator Body Massager Physiotherapy Instrument Therapy","37.888"
"High Quality Pain Relief Pulsed Electromagnetic Musculoskeletal Magneto Therapy Magnetic Therapy","473.595"
"Infrared Laser Therapy With Ce Certificate","173.652"
"Orthopedic Finger Splint Finger Splint Support Brace Price Finger Splint For Stroke Rehabilitation","86.826"
"Optics Visual Therapy Tool Vision Training Tool Therapy Card Unsuppressed Polarization Reading Uni","56.832"
"Best Selling Health Equipment Physical Therapy Traction Machine Physiotherapy Portable Ultrasound Physiotherapy","7893.25"
"Pain Relief Physiotherapy Equipment Rehabilitation Machine Multifunction Laser Therapy","2210.11"
"Shock Wave Therapy For Pain Relief Treatment","3785.603"
"Youjie Physiotherapy Inflatable Pillow Pump Neck Collar Neck Brace Cervical Traction","6.284"
"Lipo Laser Lipolysis Equipment Body Shaping Laser With Ce 980Nm Diode Laser","17365.15"
"5*5Cm Sticky Physiotherapy Electrodes Self Adhesive Electrodes Pads For Tens Unit","0.7578"
"Dog Electric Rehabilitation Treadmill Walking Rehab","884.044"
"Pulse Laser Therapy From Laser Pain Center For Carpal Tunnel Treatment","7015.521"
"2021 Aofeite Air Inflatable Neck Traction Cervical Headache Pain /Relief Neck Pain Collar","9.157"
"Cervical And Lumbar Tractor Cervical And Lumbar Stretching Table Home Lumbar Disc Herniation Treatment","173.652"
"Best Selling Product Physiotherapy Shock Wave Therapy Equipment For Electromagnetic Painrelief Therapy","4101.333"
"New Invention Best Seller Physiotherapy Use Best Ultrasound Machine For Physical Therapy For Back Pain","628.303"
"Smart Handhold Cold Laser Powercure For Pain Relief","356.775"
"With Torque Setting Function Knee Cpm Machine","4262.355"
"Tens Ems Other Household For Pain Relief Rehabilitation Massage Muscle Stimulation","28.416"
"Therapy Ultrasound 1Mhz Ultrasound Pain Relief Ed Treatment For Clinic Use","533.584"
"Grip Force 55 Sets Of Hand Strength Rehabilitation Training Five Finger Force Silicone Grip Ring Grip","11.051"
"Physical Therapy Anti Aging Pain Relief Treatment Ultrasound Therapy Machine","299.912"
"Phototherapy Low Level Laser Therapy For Lower Back Pain Relief Knee Arthritis Home Treatment Lllt 808Nm","252.584"
"Dental Handpiece Tubine Manufacturer High Speed Handpiece","50.378"
"Dentist Dental Equipment Other Instruments Lab Unit Price Electric Suntem Portable Dental Chair Price","3463.46"
"New Products Dental Chair Unit With Led Dental Operation Lamp S350 Mobile","11334.96"
"Dental Equipment Manufacturer Factory Dental Chair Price Sale Dental Unit Set Machine Luxury Led Dental Chairs","472.29"
"Rayme Korean Portable Dental Xray Unit Digital Handle Camera Scanner X Ray Portable Xray Dental Machine With Sensor Set","314.86"
"2021 High Quality Production Cheap Chair Full China Dental Unit","5034.612"
"Best Price Dental Chair Oral Dental","2991.17"
"2025 200W 50000Rpm Brushless Surgical Instruments Electronic Micro Motor Dental Machine","351.006"
"Factory Wholesale Disposable Bendable Dental Micro Applicator","1.417"
"Dental Chair Best Price Dental Chair Oral Dental Ce Approved Integral Portable Dental Unit","2518.88"
