"Product Name","Price_TND"
"Pet Small Size Easy Use Other Fiber Material Electric Pet Grooming Table","500.628"
"Orthopedic Plate L Shape Titanium","31.486"
"Stainless Steel Surgical Table Operation Table Vet Surgical Table For Clinic","1256.292"
"Orthopedic Mini Micro Small Fragment System/Set 1.5/2.0/ 2.7/3.5/4.0Mm Orthopedic","1259.44"
"Needles Used For Pigs","0.1669"
"Pig Spiral Cylinder Artificial Insemination Catheter Gun Straw Kit Artificial Insemination Equipment","0.2519"
"Burdizzo Bloodless Castrator 12"" Bloodless Emasculator/Castrating Tool/ Live Stock &","55.416"
"1801 Pet Icu Incubator Clinic Animal Incubators Puppy Dogother","626.572"
"Stainless Steel Best Quality Nose Pliers Vet Kits","56.675"
"Medical Equipment Surgical","1983.618"
"Farriers Tools Horse Hoof Loop Knife Blade","9.446"
"Eurpet Surgical Medical Pet Hospital Stainless Vet Table For Pet","314.86"
"High Quality Castrator Supplier Custom Logo Burdizzo Castrator Wholesale Castration Forceps Emasculatome","22.041"
"Stainless Steel Rabbit & Rodent Tartar Removing Forceps / Small Animal Tooth Forceps By Forgwell Industrie","11.021"
"Healing Wound Care Laser Therapy For Pain Relief Pet Dogs Horses Cats Physiotherapy Equipment","220.402"
"Orthopedic Multi-Functional Wire Twisting Forceps","103.904"
"Widely Used Animal Farm Stainless Steel 0.25Ml Cattle Cow Artificial Insemination Gun Cattle Sheep Gun","6.298"
"Stainless Steel No Blood Castration Equipment","7.085"
"Ob Chain Handle Dip Coated For 30'' 45'' 60'' Chains Calving Vet Birth Delivery Calf Foal Fetus","3.118"
"2.0/2.4/2.7/3.5Mm Tplo Orthopedic","311.712"
"Medical Premium Disposable Factory Produced Sterile Animal Urinary Catheter Pvc Cat Catheter","3.149"
"Aluminum Alloy Ear Tag Plier Puncher Pig Cow Sheep Identification Tool Livestock","25.063"
"Farrier Hoof Knife Stainless Steel With Wood Handle","5.511"
"Rabbit Artificial Insemination Gun Artificial Insemination","77.141"
"Podiatry Debridement Pack/","25.189"
"China Supplier High Quality Stainless Steel Bloodless Burdizzo Castrator For Cattle","56.675"
"Kd303 Zjkr Farming Jeringas Vacuna Plastic Steel Syringe Tpx Animal Vaccine Syringe Injector","3.464"
"Therapy For Diode Laser 980Nm","20465.9"
"Animal Obstetric Set Obstetric","267.631"
"Insemination Artificial Insemination For Dog Artificial Insemination Kits","1574.3"
"Orthopedic Box Set1.5/2.0/2.4/2.7/3.5 Mm Bone Surgical","4093.18"
"Vs-V023 Hd Camera Insemination Equipment / Dog Cow Horse Sheep Vet Artificial Insemination Device","944.58"
"Best Otoscope Set With Led Light Hospital Medical Diagnostic Surgical","31.486"
"Msu3 Full Digital Mechanical Sector Ultrasonic Diagnostic","2739.282"
"Best Stainless Steel Animal Use Pig Castration Knife","7.242"
"Animal Anesthesia Mask Vet Firefighter Pet Dog Oxygen Nebulization Therapy Mask","147.985"
"Modern And Advanced Technology Surgical Stainless Steel Trocars","9.446"
"90Cm Long Sleeve Plastic Gloves Artificial Insemination Gloves","54.471"
"Bull Holder Coild Spring/Bull Lead With Coiled Spring","0.3149"
"Hausman Emasculators Castration 23Cm","47.229"
"Stainless Steel Handle Self Control Pig Catcher","24.874"
"Equine Dental Float Rasp Straight Myi-Vet-0010","28.306"
"Pet Tablet Or Capsule Feeding Tool Pill Syringe Medicine Injector For Dogs And Cats","0.7242"
"Wholesale Cheap Gel Syringe Plastic Medical Packaging Small 5Ml Treating Cow Mastitis Syringe","0.2519"
"Molar Forceps With Adjustable Screw New Ce","28.338"
"Titolo Declaw Clamp 6 1/4 Inch","3.149"
"99.8% Accuracy Automatic Syringe Pig Livestock Large Animal Injection Vaccine Syringe","110.201"
"Animal And Equipment Steel Cats Stainless Gray Color Dogs Health Pets Material Origin Care Pan Certificate Size Year","8.155"
"Best Selling Infusion Warmer Animal Fluid Warmer For Pet Hospitals","346.346"
"Oem Service Custom Packaging Animal Other Long Pe Gloves","72.418"
"Factory Price Portable Digital Blood Pressure Monitor For Pet","450.25"
"Equipment","0.2834"
"Castration Animal Stainless Steel Castration / Best Selling","37.784"
"Animal","941.432"
"Steel 5Ml Plastic Syringe Without Dose Nut","2.362"
"Other","3.149"
"Curved Type Surgical Operating Scissors Forceps Disposable Operating Forceps For Pig","14.169"
"Clincher Curved Jaw Farrier Tools Equine High Quality Stainless Steel Hoof Clincher","29.912"
"Factory Supply Endoscope Endoscopy Camera System","7241.78"
"Knee Set Of 9Pcs To Repair Knee Injury In Animals, Knee Surgery Set","119.647"
"Ear Notcher Roof Notch Ear Notcher","6.298"
"Sialkot Pakistan Made Supplier Wholesale Cloverleaf Cut Shape Ear Notcher /Flower Shape Ear Notcher Germed","20.939"
"Amain Oem/Odm Factory Amvtm 8L Outdoor Portable Medical Equipment Vet Heart Respiration Monitor Clinical Analytical","1410.573"
"Pet Animal Thermometer Automatic Power Off Thermometer Thermometer","3.118"
"Tope Sale Reusable Stainless Laryngoscope","220.402"
"Sinohero Sh-508I-Vet Medical Syringe Infusion Pump Injector Syringe Pump For Animals Hospital Clinic","563.6"
"Dogs Cats Feeding Medicine Injector","0.6298"
"980Nm 650Nm Laser Pet Therapy Machine Small Animals Laser Therapy Equipment Pain Therapy","5034.612"
"Cattle Ai Long Gloves For Cow Artificial Insemination Equipment","51.952"
"Float Rasp Equine Dental Horse Straight Mgi-162","40.901"
"Verboczy With Clamping Parts","28.338"
"Carmalt Splinter Straight Tweezer 4.5"" Surgical By Homedica Intl","9.446"
"Orthopedics 10 Pcs Set Good Quality Stainless Steel Surgical Medical By Zabeel Industries","3.149"
"Knife Bull Holders Ring Pliers","3.149"
"Portable Animal Anesthesia Machine Diagnosis & Injection 25~75L/Min Emergency 0.5-6.0K 110/220V Hape-01","3148.6"
"Bull-Holder Without Chain For","12.595"
"Equipment Cart Trolley Surgery Medical Table Stainless Steel Surgical Operating Table Vet Operating Table","377.832"
"Equipment Ai Gun Gloves Cattle Farm Cow Artificial Insemination Gun For Cattle Materials Tools En Bovinos","9.32"
"Syringe Stainless Steel Needles Animal Syringe Needle","0.3149"
"Newberry Castrating Knife First Aid Stainless Steel Ce Approved","56.266"
"10Ml Automatic Syringe Continuous Syringe","31.486"
"Emasculator Cut The Tail And Crunches The Blood Vessel Castration Forceps High Quality","12.752"
"Reasonable Price Stainless Steel Hoof Knife With Wood Handle For Sale","6.298"
"Bull Nose Ring In Copper Ring Bull Nose Holders Cattle Leaders Nose Pincer","9.1"
"Cheap Price Best Quality Balfour Retractors Abdominal Retractor Large Pattern","31.486"
"Popular , Emasculating Equipment, Trocars And Teat Equipment","3.149"
"Gigli Saw Wire Neuro Surgical &","3.149"
"High Quality Bloodless Castrator Cattle Horses Bulls Forceps","31.486"
"Wj113 1Ml 2Ml 5Ml Syringe For Poultry, Automatic Syringe, Vaccine Fowl Injection","18.262"
"6""To24"" Homostate Forceps Set Of 7 Pieces Snake Reptiles Feeding Tongs Tweezers Stainless Steel Ce Iso","3.621"
"Equine Dental Float-Rasp Horse","47.229"
"Trimming Hooves Tools Metal Cheap Price Horse Hoof Nippers For Sale","37.784"
"Best Immunochromatography Quantitative Analyzer For Animal Disease","2204.02"
"Sy-W003 Animal Monitor Price","944.58"
"Hoof Tester 13"" Equine Tool High Quality Upgraded Pattern Stainless Steel Ce Approved","62.972"
"Pro Enterprises Of Iowa, Inc. Multi-Bolus Metal Balling Gun 2021 Customized","16.468"
"Pig Ear Mark Pliers Stainless Steel Ear Punch Marking Tools Accessories Wholesale Ear Marking","15.743"
"Pig Dental Forceps Stainless Steel Animal And Equipment Good Quality","12.595"
"Surgical Adjustable Hoof Tester 15 Farrier Horse Equine","28.338"
"Handmade 15"" Best Hoof Cutter Stainless Steel / For Horse Foot Rots","63.571"
"Double Edge Hoof Knife Left Hand With Wooden Handle Goats Pick Trimming Knives Cattle Horse Hoof Knife","4.723"
"Competitive Price Surgical Wire Twister","50.378"
"High Quality Trocar Equine Float Rasp Down Surgical","18.892"
"Full Set Stainless Steel Animal Tattoo Plier","50.378"
"Farm Cattle Weaner","0.3149"
"Emasculator Double Crush 9"" & 12""","28.18"
"Satterlee Bone Saw 12"" Orthopedic Surgical","24.874"
"Cpv Ag Canine Parvovirus Rapid Test Kit Snap Test Parvo For Dogs Other Vet Test Kit","1.89"
"Cheap Multi Purpose Hoof Nipper Farrier Tools","25.158"
"Syringe Livestock And Fowl 5Ml Drenching Medicine Gun For Animal Injection","24.874"
"Bluesao Orthopedic Large Size Sterilization Tray Holds Implants With High Quality","431.359"
"High Quality Pet Product Feeding Kit China Supply Pet Medicine Injector","1.512"
"Rasp Barness Dehorner Horn Cutter With Metallic Handle, Best Quality Dehorner Other","23.615"
"Lambert-Lowman Bone Clamp L M S Orthopedic","81.864"
"Premium Castrator Burdizzo 9"" Castration","55.101"
"Hot Sell Insemination Standard Artificial Insemination Gun","535.262"
"Stainless Steel Hoof Tester .","42.507"
"Medical Operation Cart 304 Stainless Steel Lifting Surgical Auxiliary Table","519.519"
"Syringe Livestock And Fowl 5Ml Drenching Medicine Gun For Animal Injection Balling Guns","6.298"
"Hot Selling 100% Quality Kit Stainless Steel","62.972"
"Endoscope Gastroscope System Full Set","2361.45"
"Anesthesia Equipment","6926.92"
"2022 New Model Pakistan Supplier Hot Selling Good Quality Bloodless Castrator For Sale","22.041"
"Vet Pets Stainless Steel Hydraulic Examination Table Portable V-Top Operation Electric Surgical Table","3775.172"
"12.1 Inches Tft Display Vet Handheld Monitor For Animal Use Monitor Vital Sign","1416.87"
"Kirschner Wire And Rod Cutter Forceps Orthopedic Surgical Used Equipment For Sale","251.888"
"Shoe Puller 12"" Farrier Tools Shoe Puller 12"" Horse Shoe Pull Off Hoof Nippers 12"" Nail Cutter","33.061"
"Tta Saw Blade With Completed Sizes Available For Canine","3180.086"
"S-150 Hand-Held Slit Lamp Equipment Portable Slit Lamp Other Eye Testing Use With Smartphone","2188.277"
"Factory Supply Wholesale Super Cut Metzenbaum Scissors Straight And Curved With One Blade Serrated","9.415"
"Moveable Animal Use Anesthesia Machine Intellvet Iv-1200","4722.9"
"Professional Manufactures Bull Nose Holder Multi-Size Holders For , Cattle Bull Nose Holders","15.743"
"Retractor Stainless Steel Surgical High Quality","9.446"
"Stainless Steel Teat For Sale Custom Made Size Best Teat Made With Quality Material","6.298"
"Plastic Syringe 20Ml,Plastico Bloqueo Jeringa Luer,","2.519"
"Stainless Steel Injection Needles Syringe Needle Varisized Poultry Livestock","0.063"
"Good Quality Medical Exanination Light Operating Theatre Lamp Surgical Light","3463.46"
"Cow Pregnancy Strips Wholesale Disposable Safety Cattle Cow Urine Pregnancy Test Strip For Sale","0.1575"
"Assured Quality Orthopedic Surgical And Implants Locking Plates Trauma Implants Surgery Implants","226.7"
"Hoof Care Custom Made Stainless Steel Hoof Nipper","9.446"
"Economic Dental Equipment Trolley Cart With Casters","2386.639"
"Ear Tattooing Plier For Animal Alphanumeric Digit Tattoo Pliers Hot Sale Junzi Surgical","14.169"
"Poultry 2Ml Vaccination Syringe Automatic Continuous Syringe Injector For Sale","56.675"
"Hd-8000D China Portable Cardiac Monitor With Ambulance Aed Defibrillator","9445.8"
"New Cart Type Electrocardiograph With Tilting 5 Inch Hd Lcd Screen","1426.316"
"In Stock Elastomeric Infusion Pump Portable Electric Medical Infusion Pump For Vet Hospital Bomba De Infusion","793.448"
"Hstar 6 Parameter 12.1 Inch Portable Heart Vital Sign Vet Patient Monitor Hospital Animal Icu Monitor","897.351"
"Handheld Ultrasound Sheep Pig Animal Pregnancy Scanner Ultrasound Machine","8816.08"
"Bird Feeding Needle Drench Cannula Luer Lock Cannula Animal Feeding Needle","14.169"
"Skin Diagnostic Equipment","314.86"
"Custom Stainless Steel Animal Injection Needle Hypodermic Animal Needles","0.9446"
"Artificial Insemination Device Animal Artificial Ai Gun","1127.199"
"M10 5.6 Inch 9W Color Screen Probe Preheating Animal Pregnancy Vet Test Handheld Ultrasound Machine","2515.732"
"Ceiling Animal Ot Light Led Surgical Shadowless Operating Light Led Operating Room Prices","5982.34"
"Ai Sheaths Cover Santairy Sleeve Withe Ai Gun Artificial Insemination Products Uee For Cow Horse Animals","5.983"
"Pet Brooder Nursery Icu Puppy Dog Pet Incubator Pet Cradle Animal Use Cheapest Portable Icu","2141.048"
"High Quality Coronavirus Tests Rapid Coronavirus Tests Kit For Dog Home Use Pet Care One Step Rapid Test Kit","7.872"
"Professional Vet Monitor Spo2 Blood Pressure Pulse Rate Blue Tooth Portable Animal Monitoring Blood Pressure Pet","878.46"
"Farm Circlip Insemination Gun Universal Type Stainless Steel Insemination Gun","94.458"
"Handheld Ultrasound Sheep Pig Animal Pregnancy Sonar Scanner Ultrasound Machine","2518.88"
"12.1 Inch Hospital Clinic International Standard Permanent Body Temperature Probe Vet Patient Monitor","2043.442"
"Clinic Stainless Steel Pet Ultrasound Table With Facuets Pet Vet Operation Table","1401.127"
"Factory Price Orthopedic 4.0Mm Locking Plate Set Surgical","1196.468"
"Crossley Molar Stainless Steel/","8.817"
"Farriers Tools Horse Hoof Loop Knife","18.892"
"Artificial Insemination Kit Gun For Cow Insemination","40.932"
"Eur Pet High Performance Anesthesia Machine With Isoflurane Evaporator","1256.292"
"Laptop Ultra Sound Machine& Ecography Dw500Other","629.72"
"Farm Cattle Horse Hoof Knife Shears Right Handed Double Edge Sheep Goat Pig Castration Animal Foot Pruning Tools","3.149"
"Factory Hot Sale Long Sleeve Plastic Artificial Insemination Examination Gloves","14.547"
"Bloodless Castrator For Lambs","38.571"
"Podiatry Assistant Pack/","25.189"
"Orthopedic Stainless Steel Spay Pack","850.122"
"Animal Europlex Metal Gun Syringe 30Ml - 50Ml Animal &","6.298"
"Metal Syringe Injection Glass Sampler Livestock Stainless Steel","26.764"
"Laryngoscope Set Hospital Medical Diagnostic Surgical 9 Pcs Set","62.972"
"X Ray Reference Ball Orthopedic","103.904"
"Potable Dehorning Fast Remove Cattle Horn Machine Manual Calf Sheep Goat Dehorner Wire Saw","56.675"
"Protatable Color Vet Ultrasound Device / Veteinary Equipment /","2833.74"
"Medical Sterile Animal Urinary Catheter Cat Catheter","0.3149"
"Tplo Jig Small Stainless Steel Orthopedic Implants Orthopedic Surgical","1221.657"
"Beijing Eaven Medical Tplo Saw Medical Electric Power Drill Tools Orthopedic","3306.03"
"Equine Stomach Equine Stainless Steel Tube Equestrian","94.458"
"20G 25Mm(1Inch) Stainless Steel Needles Syringe Metal Needle","1.26"
"Dog Ear Cropping Clamps With Teeth Doberman Pitbull Ear Cropping Tools For Vet Clinic","49.308"
"Syringe Stainless Steel Needles Animal Syringe Needle","1.543"
"Hot Sale Medical Equipment Surgical Sets Screw Box Box For Screw And Plate","188.916"
"Quality Animal Castration","18.892"
"Surgical Surgical Animal Pet Surgical Set","94.458"
"Yushuoda Equipment Surgical Table","1259.44"
"Osteotome German Stainless Steel Orthopedic","3.149"
"Top Hoof Knife With Wood Handle","5.511"
"Popular Sale Therapy For Vet Diode Laser 980Nm","9445.8"
"High Quality & Surgical | Alligator Forceps 3.5"" Surgical","3.149"
"Hoof Knife With Wood Handle High Quality Hoof Knife","6.298"
"Mayo Hegar Needle Holder 7"" German Dental Surgical","3.149"
"Batersuarg---Visual Artificial Insemination Gun (Cow)/Animal / Transcervical Insemination Gun(Cattle)","629.72"
"Clinic Operation Table, Equipment Animals Vet Operation Table/","1416.87"
"High Quality Bloodless Castrator With Cord-Stop For Bull And Big Animals","78.715"
"Direct Factory Wholesale Top Price Stainless Steel Tool Kit New Arrival Farrier By Entonia Industry","18.892"
"High Quality Professional ,Farrier Tools ,Half Round Farrier Horse Hoof Nipper Heavy Duty","23.458"
"Orthopedic Set For","283.374"
"Poultry Cow Mastitis Super Paddle Test","1.575"
"Your Pet Care Dog Ccv Test Kit/Canine Rapid Test/Vet Test Detection","57.935"
"Hausman Emasculators Castration Manufacturers Sialkot Pakistan","34.63"
