"Product Name","Price_TND"
"Used Portable Diasbled Patient Electric Foldable Up And Down Stair Climbing Power Wheelchair Rehabilitation Equipment","2298.478"
"Color Low Temperature Thermoplastic Splint Materials For Occupation Therapy","62.972"
"Orthopedic Arm Sling With Abduction Pillow Upper Limb Orthosis Shoulder Brace With Pillow Arm Sling","19.994"
"Mt Factory Directly Sale Detachable Elderly Electric Wheelchair","1196.468"
"Mkx-Ywj-01A Superior Multi-Functional Wheelchair With Back Opening Convenient For Patient Transfer, Shower And Commode","846.974"
"Stroke Rehabilitation Gait Training Robotics","787150"
"Health Care Pressotherapy Lymphedema Compression Massage Machine 12 Chamber Blood Circulation, Sport Muscle Recovery 65W","2046.59"
"New ! In Stock Lightweight Standing Frame Aluminum Folding Walking Aid Walker Frame For Disabled Walking Frame","31.172"
"Teleco Top Quality Inflatable Cervical Collar Air Neck Traction","94.458"
"Velpeau Grade Foot Ankle Protector Gel Version Comfort Stabilizer Rehabilitation Sports Ankle Sock Brace","53.212"
"Hospital Cerebral Palsy Equipment For Children Type Standing Frame","472.29"
"Adjustable High Quality Orthopedic Drop Ankle Foot Leg Orthosis Of Lower Limb Orthoses","330.603"
"New Patent Foshan Highway Foldable Steel Durable Rollator 3 Wheel Walker Steel Rollator With Shopping Bag","151.133"
"Biobase Wholesaler Walking Stick Aluminum Four-Legged Crutches Cane Walking Stick For Elderly","9.446"
"Aluminum Foldable Lightweight Electric Wheel Chair Folding Recling Electric Power Wheelchairmotor For Equipment","1511.328"
"Physiotherapy Shockwave Shock Wave Pain Relief Ultrasound Shockwave Therapy Machine Extracorporeal Shockwave","5979.192"
"Manufacturer Handicapped Wheelchair Foldable Electric Wheelchair","192.065"
"Rehabilitation Therapy Hospital Patient Transfer Disabled Lifting Chair Commode Shower Electric Wheelchair Seat Toilet","1190.171"
"Equipment Walking Aid Stainless Steel Aluminum Alloy Crutches Axillary Crutches","25.189"
"Ce Approved Fes Foot Drop Treatment For Stroke Rehabilitation","94.458"
"Rehabilitation Walking Assistant Walking Frame For Adult Using","488.033"
"Multi Function Home Care Rehabilitation Nursing Bed","3463.46"
"Hot Selling Manual Wheelchair Small Size Portable Rehabilitation Disabled Self-Pushing Wheelchair","76.511"
"Factory Direct Saleshospital Beds Prices Medicalmedical Beds For Saleelectric Bed","1279.119"
"Biobase Mfw880L Stair Climbing Wheelchair Rehabilitation Disabled Use Electronic Smart Wheelchair","393.575"
"Equipment Functional Electrical Stimulation For Stroke Rehabilitation Fes Stimulation Foot Drop Equipment","944.58"
"Exercise Rehabilitation Physical Therapy Frosted Table","34571.628"
"Post Op Articulated Adjustable Range Of Motion For Arthritis For Healing Osteoarthritis Leg Support Knee Brace","22.009"
"Rehabilitation Equipment Aluminum Mobility Folding Motorized Manual Electric Power Wheelchair","409.318"
"Chinese Verified Supplier Pressure Relief Air Bed Mattress With Pump","425.061"
"Adjustable Elbow Brace Arm Sling","44.081"
"Lightweight Walker Rollator With Seat And Brakes","110.201"
"Kooeej High Quality Cheap Rehabilitation Care Portable Electric Mini Exercise Bike For Disabled","2424.422"
"Aluminum Disabled Crutches Elbow For Hospital And Home Used Walking Crutch For Old","12.595"
"Thermoplastic Orthopedic Phalangeal Joints Trigger Finger Splint","15.743"
"Recovery Rehabilitation Adjustable Orthopedic Hip Abduction Brace Hinged Hip Support Brace For Adult","61.713"
"Chiropractic Bed Treatment Rehabilitation Equipment Used In Hospital 6 Sections High Quality Hot Sale","15743"
"Hkjd 2022 Hot Selling Manufacturer Orthopaedic Aircast Air Cam Fracture Short Walker Boot Inflatable Walking Boot","78.715"
"Disposable Supply Implant Stabilizer Bands After Breast Surgery (D)","28.338"
"Hot Sale Elderly Fashion Foldable Adjustable Walking Sticks Cane Seat Elderly Led Cane With Chair Price","14.484"
"Rehabilitation Knee Walker Physical Therapy Training Equipment Handicap Scooter Lightweight Disabled Walking Aids","151.133"
"Rehabilitation Equipment Orthopedic Prosthetic Limbs Infrared Oven , Infrared Heating Flat Oven","12846.288"
"Artificial Limbs Casting Elastic Surgical Stockinette Nylon Prosthetic Leg","28.023"
"Rehabilitation Equipment Electric Hospital Bed Mattress For Homecare","881.608"
"Ysfbl760101 High Quality Rehabilitation Commode Chair For Elderly","47.229"
"Used Portable Diasbled Patient Electric Foldable Up And Down Stair Climbing Power Wheelchair Rehabilitation Equipment","1889.16"
"Sport 1 Folding Transport Wheelchair With Full Arms And Removable Swing-Away Footrest, Black","125.944"
"Mt Comfortable Foldable Design Steel Tube Full Bed Wheelchair For Sale","81.864"
"Stroke Rehabilitation Hanging Hammer Type Hand Exercise Table Finger Flexion And Extension Trainer","277.077"
"Rehabilitation Glide Rotator Elderly Walker Therapy Supplies Foldable Knee Walker With Knee Support","122.796"
"Amazon Hot Sale Rehabilitation Neck Support Traction Brace Cervical Collar Neck","20.75"
"Light Weight Wheelchair Adjustable Folding Manual Hand Push Wheelchair For Elderly Patient","91.31"
"Engin Good Price Hospital Wheelchair","629.72"
"Stroke Rehabilitation Robot Physiotherapy Equipment Hand Rehabilitation Trainer","771.407"
"Robot Assisted Rehabilitation Walking Asist Walking Rehabilitation Equipment","787150"
"Surgery Rehabilitation Finger Cot /Finger Splint","0.3149"
"Adjustable Back Therapy Posture Corrector Clavicle Back Brace Support Shoulder Belt Shoulder With Pump","11.084"
"Velpeau Neck Brace Cervical Spine Pain Cool Soft Silicone Neck Collar To Prevent Stiff Neck Support Brace For Sleeping","47.198"
"Height Adjustable Walker Ref913","15.743"
"Elbow Crutch Adjusting S M L Axillary Crutches Adjustable Lightweight Crutches","17.318"
"Teleco New Generation Inflatable Collar Neck Stretcher","62.972"
"Folding Walker Aluminum Walker Rehabilitation Therapy Supplies Lightweight Walker For Adults","37.784"
"Hochey Rehabilitation Disabled Wheelchair Foldable Full Reclining Manual Chair Lightweight Disabled Adult Children Chair","78.715"
"Folding Hand Adjustable Footrest Small Size Portable Rehabilitation Custom Color Wheelchair For Disabled","85.013"
"Wheelchair Lift With Toilet Seat Cushion Nursing Chair Bath Patient Elderly Transfer Wheelchair For Home Hospital Care","784.002"
"China Wheelchair Product Wheelchair Scale Stand Up Wheelchair","154.282"
"Rehabilitation Walking Assistant Walking Frame For Adult Using","488.033"
"Aluminum Folding Mobility Old People Standing Rollator Walker Walking Frame For Disabled People Lightweight Portable","31.172"
"Hot Selling Crutch Patient Underarm Walking Stick Old People Elderly Walking Aids","18.262"
"Biobase China 4 Legs Aluminum Alloy Lightweight Adjustable Elders Disabled Walking Stick Quad Cane","9.131"
"Chinese Manufacturers Walking Stick Crutch For Sale","10.076"
"Eswt Shockwave Therapy Machine Erectile Dysfunction Rehabilitation Therapy Eswt Supplies","5399.849"
"Orthopedic Rehabilitation Healing Post Operative Shoes","7.872"
"New Arrival Wholesale Supply Cheap Electric Wheelchair For Disabled Equipment For Rehabilitation","333.752"
"Stroke Hemiplegia Rehabilitation Training Physical Therapy Equipment Finger Board Grip Ball Fixed Finger Grip","15.429"
"High Performance Neurorehabilitation Rehabilitation Equipment Luna For Neuro-Motor Rehabilitation","108280.354"
"Cheap Rehabilitation Therapy Supplies Walking Training Folding Aluminum Alloy Walking Aid For Adult And Kid","50.378"
"Rollator Folding Walker Portable Adjustable Shopping Outdoor Aluminium Rollator Walker With Seat","110.201"
"Biobase Rehabilitation Wheelchairs Price Manual Wheelchair For Patients","311.712"
"Hot Selling Axillary Crutches Aluminum","10.076"
"Large Rollator Walker Compact Foldable Easy To Fold Lift & Carry Comes With Cane Holder Walking Rollator","122.796"
"Biobase China Wheelchair Home Rehabilitation Treatment 20 Inches Rear Wheel Wheelchair For Hospital","94.458"
"Patient Care Advanced Handicapped Foldable Lightweight Folding Power Electric Wheelchair","1253.143"
"Hochey 801 Ready To Stock Hospital Electric Foldable Wheelchair Factory Price","1254.34"
"Yb-Qzh Multi-Function Training","4408.04"
"Physical Therapy Shock Wave Rehabilitation Equipment","18888.452"
"Inflatable Ankle Orthosis Rehabilitation Shoes","180.667"
"Physiotherapy Home Assisted Stroke Hand Exerciser Hand Finger Rehabilitation Trainer Exercise Robot","613.977"
"Afo Foot Drop Orthosis Brace Upgrade Support","23.615"
"Breathable Heightened Double Airbag Adjustable Orthopedic Thoracolumbar Brace Rehabilitation Fixed Support","68.64"
"Hyperextension Brace Orthosis Lumbar Spine Orthosis For Jewett Brace","94.458"
"Recovery Rehabilitation Adjustable Orthopedic Hip Abduction Brace Hinged Hip Support Brace For Kids","66.121"
"Rehabilitation Therapy Equipment Rollator Walker Mobility Moving Disabled Upright Walker Foldable With Height Adjustable","138.539"
"Disposable Supply Post Surgery Abdominal Compression Band (M)","28.338"
"Rehabilitation Therapy Supplies Light Weight Hospital Home Adjustable Folding Aluminum Alloy Elbow Crutch For Disable","8.344"
"Artificial Limbs Easy Pull Sleeve Prosthetic Leg Products","47.229"
"Lumbar Support Orthosis Splint Body Jacket Low Temperature Thermoplastic Splints","220.402"
"Mt Manufacturer Folding Portable Electric Wheelchair Sale","1322.412"
"China Factory Soft Neck Orthopedic Support Soft Foam Neck Brace Adjustable Black Cervical Collars","3.149"
"Rehabilitation Exercise For Hand Physical Therapy Training Wrist And Finger Trainer For Orthosis","78.715"
"Velpeau Tendonitis Pain Relief Octopus-Shaped Splint Orthopedic Rehabilitation Thumb Protector","48.457"
"Cheap Aluminum Folding Walker Adjustable Portable Walking Frame With Seat For Clinic, Hospital Children, Adults, Elderly","31.172"
"Hospital Walking Rehabilitation Equipment Parallel Bars","913.094"
"Small Wheelchair Motorcycle Mobility Electric Scooter For Rehabilitation","944.58"
"Adjustable Hkafo Brace Orthosis Kafo Leg Brace Support With Lower Limb Support","330.603"
"Wheel Chair Brushless Motor Aluminum Foldable Electric Wheelchair Price Sillas Ruedas Cadeiras De Rodas","857.679"
"Emtt Magnetic Machine Extracorporeal Pain Relief Massage For Spa Home Magnetic Transduction Therapy","6294.052"
"Hospital Walking Rehabilitation Equipment Parallel Bars","913.094"
"Manufacturer Rehab Equipment Hand Exerciser","314.86"
"Wheelchairs In Kuwait Folding Wheelchair With Ce Certificate","409.318"
"Walker Foot Drop System Walking Aids For Dropped Foot Patients","9.446"
"Chinese Verified Supplier Pressure Relief Air Bed Mattress With Pump","170.025"
"Aluminium Adults Disabled Elderly Seniors Upright Walker Rollator Foldable Walker Frame Walking Aids","34.635"
"Multi Function Home Care Rehabilitation Clinic Bed","3463.46"
"Hip Knee Ankle Foot Brace Orthosis For Rewalk","330.603"
"Biobase Wheelchair Home Rehabilitation Double Brake Wheelchair For Lab","125.944"
"Mobility Equipment Table For Training Rehabilitation","34571.628"
"Biobase China Semi-Electric Hospital Bed Manufacturers Home Care Beds","406.17"
"Orthopedic Back Brace Thoracolumbar Orthosis","266.876"
"2023 Wholesale New Product Comfortable White Black Hand Rehabilitation Robot","469.142"
"Rom Knee Brace Support For Knee Pain/Knee Brace For Osteoarthritis/Knee Brace For Oa","45.498"
"Supplies Knee Brace Knee Joint Stabilizer Orthopedic Rom Advance Post Op Knee Brace For Rehabilitation","46.285"
"Luxury Upgraded Height Adjustable Orthopedic Thoracolumbar Brace External Fixation Support Rehabilitation","106.423"
"Multi-Functional New Rehabilitation Tools Europe Style Walking Aids Equipment For Disable And Elderly People","119.647"
"Disposable Supply Post Surgery Compression Bra (R)","37.784"
"Prosthetic Raw Material 22Cm Casting Elastic Surgical Cotton Stockinette Artificial Limb Leg","100.756"
"Eswt Shockwave Physiotherapy Equipment Rehabilitation Machine","5667.48"
"Adjustable High Quality Post Op Orthopedic Hinged Knee Immobilizer Support Brace Of Lower Limb Orthoses","330.603"
"Health Rehabilitation Neck Brace Cervical Collar Comfortable Collar Neck Brace For Relieve Cervical Pain","35.233"
"Rehabilitation Training Foldable Aluminum Steel Frame Walking Aid Walkers For Disabled Folding Walking Aid For Adults","31.172"
"Hospital Physiotherapy Rehabilitation Equipment Tilt Adjustable Rehabilitation Bed For Disabled","5667.48"
"Foldable Electric Power Patient Lift Hoist Lift","2830.592"
"Scooter Electric Mobility Four-Wheel Folding Scooter For The Elderly Electric Mobility Transformer Scooter","1826.188"
"Hospital Cerebral Palsy Equipment For Children/ Adult Type Standing Frame For Person","818.636"
"Rehabilitation Treatment Equipment Cross Trainer For 4 Limbs Made In China Hot Sale On Line","8186.36"
"Shoulder Posture Protector Wrap Brace Black Shoulder Support With Pump Belt Pain Relief Sport Use","11.084"
"Remote Control Automatic Electric Folding And Opening Wheelchair Power Wheel Chair For Disability","107.053"
"Orthopedic Instruments Orthotic Rubber Bowl Prosthetic Tools Prosthetic Plaster Mixing Bowl","9.446"
"Wholesale Adults Aluminum Disabled Foldable Crutch Walking Stick For Old","6.927"
"Biobase Walking Stick In Stock 4 Legs Rehabilitation Walking Stick For Disabled Elders Old Man","9.446"
"Equipment Rehabilitation Physical Therapy Table","34571.628"
"Orthopedic Lumbar Support Orthosis Lumbar Brace","467.032"
"Hospital Electric Finger Exercise Healthcare Multifunctional Stroke Hand Function Rehabilitation Robot Machine","613.977"
"Factory Price Nylon Knee Brace Knee Joint Protector Adjustable Knee Support","46.285"
"Foldable With Height Adjustable Rehabilitation Rollator Physical Therapy Training Equipment Walker Rollater","132.242"
"Adjustable Orthopedic Stabilizer Reinforced Fixed Belt Walking Strap Non-Slip Fixed Knee Joint Fixed Support","85.328"
"Adjustable Ce Cervical Neck Collar Cervical Collar Neck Brace For Neck And Shoulder Pain","33.061"
"Disposable Supply Post Surgery Breast Compression Garment Bands (A)","28.338"
"Anti Drop +A2:E29Water Resistant Noise Reduction Hearing Loss Seniors Rechargeable Deaf Bte Hearing Aid","20.466"
"Machine Digital Ear Amplifier Digital Cic Rechargeable Custom Hearing Aid","69.585"
"2022 Newest Low Price Wireless Noise Cancelling Hearing Aids Digital High Quality Rechargeable Elder Product Amplifier","32.431"
"Hearing Aid Cofoe Bte New Style Home Popular Adjustable Tone Sound Amplifier Hearing Aid","21.411"
"High Demand The Elderly People Products Hearing Aids For Amplifier","50.063"
"Rechargeable Digital Hearing Aid","136.97"
"Audifonos Para Sordos Bte Hearing Aids Rechargeable Heraing Aids For Deafness G25L","29.912"
"2021 Hot Sales Telecoil Trimmer Earhook Hearing Aid Microphone","47.229"
"100% Natural Beeswax Ear Candle Wax Removal Ear Cone Canding Ear Candle","0.126"
"Small Handy 4 Listening Modes Cheap Buy Oem Deaf Hearing Aid","34.635"
"Medical Ear Digital Hearing Aid","25"
"Hot Sale Ce Products Personal Sound Amplifier Rechargeable Hearing Aids","136.965"
"Hot Selling Product Digital Hearing Amplifier High Quality Power Rechargeable New Ear Hearing Aid Audifonos","15.114"
"Newest Design Rechargeable Xb-202 Electronic Hearing Aids Bluetooth And Headphones With 3 Pcs Earplug","25.126"
"New Products 2021 Unique Arrival Hot Products Earsmate Portable Hearing Aid For The Deaf For Japan Market","78.684"
"My-G057T-18 Medical Batteries Hearing Aid Price Cheap Sale Invisible Hearing Aids For The Deaf","3.149"
"Great-Ears G20B Bte Hearing Aid Ear Sound Amplifier Headphone For Elderly","11.65"
"Starkey Eargo Nano Widex Oticon Mini Hearing Aid Amplifier Sale Noise Cancelling Low Cost Bte","129.093"
"Digital Ric Hearing Aid Hot Sell Internal Hearing Aids For Hear Disable Person","62.972"
"100% Natural Beeswax Hopi Ear Candle Wax Removal Ear Cone Canding Ear Candle Sticks","0.4723"
"Deafness China Hearing Elderly Products Electric","78.715"
"Medical Ear Bte Dsp Digital Chip Hearing Aid","153.085"
"China Suppliers Audifonos Mini Invisible Hearing Aids For The Deaf Rechargeable Hearing Aid Isitme Cihazi","170.025"
"Ear Wax Removal Candle Bewax Ear Candles Fragrance 20Cm With Stopper Navel Candles","0.6298"
"China Manufacture Cheap Price Ear Machine Hearing Aid Tinnitus","31.486"
"Austar Hearing Aid In China Wholesale Aparelhos Auditivos Invisivel Hearing Aid Mould Wax Filter","94.458"
"Other Of Buy Cheap Price Of Rechargeable Hearing Aid Amplifier Invisible Mini Hearing Aids For Deafness","47.229"
"Elderly Medical Rechargeable Earphone Hearing Aid","67.695"
"Best Selling Medical Hearing Aid Earphone Earplugs Sound Amplifier Aid Hear For Hearing Loss","125.315"
"For In-Ear Mini-Invisible Hearing Aids Audifonos","17.318"
"China Oem Rechargeable Hearing Aid Medical For Seniors","17.349"
"Hearing Aids Rechargeable Bte Portable Mini Noise Reduction Hearing Aid","308.563"
"Min Rechargeable Ear Buy Hearing Aid Digital Amplifier Hearing Appliance","440.49"
"Rechargeable Digital Ric Hearing Aid","812.339"
"Products Listening Devices China Bte Hearing Aid","26.291"
"Medical Ear & Hearing Products Rechargeable Bluetooth Batteries Hearing Aids Price List","73.993"
"Wholesale Ear Candle/Wax Ear Candle/Beeswax Indian Ear Candle For .Oem","0.9131"
"Products Best Product High Value Rechargeable Hearing Aids","31.172"
"Wholesale Hearing Aid Amplifier","18.892"
"Portable Digital Hearing Aids For The Deaf Hearing Aid For Deafness Price","9.446"
"Medical Ear Bte Digital Hearing Aid","223.52"
"Pure Beeswax Indian Ear Candle For Salon","2.677"
"Factory Rechargeable Economical In The Ear Hearing Aids Sound Amplifier Aid Waterproof Color Beige Aid","11.556"
"Elderly Food Grade Approved Medical Equipment Resound Hearing Aid Ear Tip China Bte Hearing Aid Ear Plugs","0.0315"
"Hearing Loop Device Wdrc Digital Hearing Aid Ear Aids","122.796"
"Quality Hearing Aid Amplifier Rechargeable Hearing Aid Wireless Phone Call Hearing Aid","314.231"
"High Quality Digital Programmable Rechargeable Hearing Aid App Control","729.752"
"Trending Products 2021 New Arrivals Rechargeable Bt Hearing Aid Amplifier","28.338"
"Machine Digital Ear Amplifier 10 Channels Rechargeable Custom Hearing Aid","182.619"
"China Very Popular Ear & Hearing Products Hearing Aid Ear Aids Audifonos Medicados Other Healthcare","9.068"
"Factory Direct Selling Popular Hearing Aid 10 Cell Products Comfortable","724.178"
"Custom Best Ear Hearing Aid Prices Elderly Assistive Listening Device Hearing Loss Products","11.021"
"High Value Comfortable Hearing Products Adjustable Volume And Programs Deafness Equipment","141.687"
"Fragrance Ear Wax Remover Candle Fragrance Wax Hopi Candle With Tube For","0.5668"
"Other Healthcare Of Amplifier Invisible Hearing Aid Mini Hearing Aid With Mdr Ce Certificate From China Manufacturer","80.29"
"Cheaper Hearing Aids Usb Charging Port Hearing Loss Mini Portable Aids For Deafness","68.01"
"Aparelhos Auditivos Rechargeable Hearing Loss Intelligent Denoising Digital Hearing Aid For Deaf Deafness","189.011"
"New Arrival Low Cost Digital Rechargeable Hearing Amplifier For The Deaf Invisible Prices Ear Hearing Aid","59.509"
"Rechargeable Blue Tooth Bt Hearing Aid Nano Hearing Aids G25Bt","42.507"
"Bte Ear Aids Sound Amplifier Deaf Hearing Earphone For Adults Great-Ears G20","11.021"
"Ear Hearing Products Wireless Earphones Hearing Aids For Deafs","157.43"
"Hot Selling Product Digital Hearing Amplifier High Quality Power Rechargeable New Ear Hearing Aid Audifonos","28.338"
"Factory Wholesale Psap Rechargeable App Hearing Aid Digital Ear Aid Sound Amplifier For Hearing Loss","125.315"
"Ear Amplifier For To Sell Online Innovative Unique Products 2021","100.756"
"China Hear Amplifier 90Db 4 Channels Cheap Hearing Aids Bte Aid For Seniors Of Spieth","154.282"
"Wholesale Audifono Para Sordera Aid Auditive Blue Tooth Rechargeable Product","62.972"
"Products Hearing Aid Best Bte Analog Rechargeable Sound Amplifier","25.189"
"High Quality Cheap Hearing Aids Hearing Aids Rechargeable Amplifier Bluetooth Wireless Hearing Aid For Deaf","37.469"
"Great-Ears G17 Manufacture Hearing Aid For Hearing Loss Elderly","29.912"
"Medical Ear Wholesaler Digital Bte Hearing Aid","122.796"
"Portable Mini In Ear Invisible Sound Amplifier Adjustable Tone Digital Hearing Aid Rechargeable For Deaf","17.318"
"Digital Bt Bte Hearing Aid Gio 402Bt Retone New Design Digital Mini Amp Hearing Aid 9021400000 Adjustable","239.294"
"China Oem Hearing Aid Earbuds Hearing Rechargeable Aids Digital Medical Hearing Aids For Seniors On Tv","173.173"
"2021 Best Selling Battery New Amazon Popular Product Ear Sound Amplifier Hearing Aid","78.715"
"Voraiya Suppliers G400 Amazon Sells Otc Old Man Hearing Aid Earphone","65.177"
"New Product Wholesales Medical Hearing Aids Rechargeable Noise Reduction Behind Ear Digital Hearing Aid For Deafness","43.042"
"8 Channels Processing 3 Program No Whistle Hearing Aid Non-Programmable Products","88.161"
"2020 New Economical Hearing Amplifier Digital Hearing Amplification For The Deaf Accessories Bte Ear Hearing Aid","13.288"
"Set Package Popular Product Indian Hopi Ear Candle Remove Earwax Ear Candle","0.3779"
"F-998B Deafness Sound Amplifier Best Selling Products For Elderly Healthcare Tools Products","78.715"
"Hot Sale Newest Product 100% Natural Bee Wax Ear Candles For Ear Cleaning Oem Odm Ddp","0.7872"
"New Trending Product Jinghao Ce Iso Cic Invisible Mini Hearing Aids","47.229"
"Indian Ear Candle Product 100% Natural Beeswax Ear Wax Removal Candle","5.668"
"Best Price Hearing Aid Cleaning Brush With Magnet And Loop Product Audfonos Hearing Aid Accessories","0.6298"
"Hodaf Tray Fragrance Aromatherapy Ear Wax Removal Ear Treatment Indiana Candling Ear Candle","0.3149"
"Wireless Aids Rechargeable Hearing Loss Intelligent Denoising Digital Hearing Aid For Deaf Deafness","189.011"
"Medical Device Rechargeable Digital Hearing Aid Portable Wireless Ear Amplifier For Elders Deafness People","132.871"
"Hearing Aid Hearing Amplifier Battery Audifonos Para Sordos G10","12.595"
"Retone 2021 Digital Bte Hearing Aid 2 Channels Wdrc Amplifier Microphone Hot Selling","47.229"
"New Products Earphone For The Deaf Price Rechargeable Charging Case Hearing Aid G12X","29.912"
"Jinghao Medical Ear Rechargeable Digital Hearing Aid","136.965"
"Morden Style Trending Product 2022 New Arrival Hearing Aid","20.466"
"Ear Mini Electric Intelligent Volume Hearing Aids For Elderly Audifonos Medicados Digitales","47.229"
"Bte Hearing Aid Suitable For The Elderly Hear Rechargeable Hearing Aids Digital","251.259"
"Digital Beautiful New Style Comfortable Ear Hearing Portable Hearing Aid","245.591"
"High Quality Digital Rechargeable Hearing Aid","67.695"
"Product Private Label Honey Ear Wax Candle For Ear Cleaning","0.2834"
"Small Package Hearing Aid Wax Guard Filter In Other Healthcare","3.149"
"Jinghao Otc Products Listening Devices China Bte Hearing Aid","47.229"
"Hot Sale Ce Products Personal Sound Amplifier Rechargeable Hearing Aids","26.291"
"New Products 2022 Unique Trending Products Hearing Aids Rechargeable Products","17.349"
"Cofoe Ear Hearing Aids Wholesale Hearing Aid Amplifier With Usb Charger","26.764"
"New Products 2022 Best Quality Suppliers Rechargeable Digital China Hearing Aid","147.985"
"Newest Wholesale Aiding Hear Products Wireless Audifonos Invisible Hearing Aids For Deafness Other Healthcare","39.358"
"Most Selling Product In Alibaba China Bluetooth Hearing Aids For Seniors","73.993"
"America And Europe Hot Sell Medical Ear Products Body Wear Equipment In Clinic","141.687"
"Personal Products Ear Instrument Amplifier Telecoil Hearing Aid For Old Man","221.347"
"Ear Hearing Product Ear Wax Remover Ear Candle Organic","0.8187"
"Other Healthcare Bme001 Best Prices Ear Hearing Aid Products","34.635"
"Acosound Ric Digital Hearing Aids Ric China Price For Products","532.114"
"Trumpet Shaped Beeswax Ear Cleaner Ear Wax Removal Tool For","0.3149"
"Ear Cleaner Happy Ear Ear Candle 100% Pure Beeswax","0.6298"
"Oticon Opn Rite Mini Bte Digital Hearing Aid New Launch 2018 Hearing Aids Healthcare Wholesale Rechargeable Digital","2906.992"
"Universal Bte Hearing Aids Smart Noise Reduction 4 Channel Wdrc Processing Ear Hearing Aids","100.756"
"High Quality Hearing Aids Usb Charge Other Healthcare Lcgfs-10","1613.784"
"Latest Product Healthcare Comfortable Wear Hearing Solutions Made-In-China Low Price Pocket Hearing Aids For Sale","11.965"
"Medical And Products, Compact And Easy To Wear, Ear-Hanging Hearing Aids For Middle-Aged And Elderly People","53.527"
"Hot Sale Hearing Amplifier Ear Device Loss Aid For Elderly Deaf Hearing","106.266"
"2021 Healthcare Wholesale Rechargeable Digital Cheap Mini Hearing Aids For Deaf Ear & Hearing Products","18.514"
"Ear Wax Remover Candle Fragrance Wax Hopi Candle With Tube","0.5668"
"Cheaper High Quality Healthcare 12 Channel Dsp Digital Chip Hearing Aid For Reselling","153.085"
"Healthcare Relax Aroma Cone Ear Candle","0.6927"
"Super Invisible Hearing Aids Other Healthcare Power Bank Function Device For Hearing Loss Hearing Aids Factory","47.229"
"Devices Price Mini Rechargeable Hearing Loss Ear Hear Products Aid Deaf Hearing Aids For Seniors","195.214"
"Safety Enno Hearing Aids Rechargeable Amplifier For The Old People","50.063"
"Noise Reduction Hearing Amplifier Hearing Losses Invisible Ite Hearing Aids Amplifier For Seniors","110.201"
"G17 Amplifier Sound Amplifier Audifonos Para Sordera Adjustable Hearing Aids","29.912"
"Hot Selling Charging Mode Hearing Aid Sound Amplifier Invisible Design Rechargeable Beige/White Smart R Ce","377.832"
"Petiro S1 Handheld Vet Ultrasound Scanner Ecografo Portatil Medical Ultrasound","2046.59"
"Hcy 5Min Animal Disease Rapid Test Kit Dog Canine Parvovirus Test Kit","1.638"
"Beijing Eaven Medical Spay Pack Dental Kit","787.15"
"Portable Clinic Equipment Digital Thermometer","18.892"
