"Product Name","Price_TND"
"Dental Ultrasonic Scaler Portable Scaler Detachable High Quality In Cheap Price With Hot Selling","409.287"
"Good Quality Stainless Steel Dental Probes Oral Care Set Custom Logo Dental Probe","5.133"
"Dental Tools Kit Teeth Cleaning Set Dental Pick Stainless Steel Dental Hygiene Set Dentistry Tools","0.0315"
"Portable And Foldable Dental Chair With Ce Iso Certificate","3148.6"
"Hospital Dental Supplies Laboratory X-Ray Surgical Ultrasound Surgery Instruments Health Equipments","3148.6"
"Full Computer Control Best Price Oral Dental Dental Chair Dental Equipment","7241.78"
"Electromagnetic Wax Melting Machine Other Dental Equipments","600.124"
"Dental Orthodontic Instruments Dental Extraction Elevators For Dental Use Equipment","12.595"
"Scalers Instruments Dental Student Instruments Other Dental Equipment'S","2.047"
"Dental Equipments Other Dental Equipments Customization Dental Instruments Orthodontic Instruments","16.058"
"Dental Cleaning Tools 6 Pack Dental Hygiene Kit Teeth Tool Set For Home Use High Quality In Wholesale Low Price","6.927"
"2022 New Dental Root-Canal Pluggers","5.983"
"Best Price Dental Chair Oral Dental","692692"
"Dental Loupe With Led Light Dental Equipment For In Good Price","283.374"
"Mars International Tiltable Dental Operating Microscope Health & Quality Manufacturer","7868.352"
"New Arrival Goldman Fox Scissors Curved Tip Dental Surgical Micro Shears","3.779"
"New Style Abs Enclosure Suction Machine Health Ogas Suction Pumpri","157.43"
"Senn Muller Dental Retractor 55X11Mm","18.892"
"980Nm Dental Soft Bio Surgical Laser Therapy","6297.2"
"Indian Manufacturer Curved Tip Dental Blade","3.149"
"Home Teeth Whitening Gel Dental Care With Bleaching Kit Led Whitening","81.864"
"Dental Snoring Anti Snoring Snoring Brackets Orthodontics","0.9446"
"Paper-Film Sterilization Pouch Rolls/Reels For Packing","12.595"
"Dental Stainless Steel Dental Tweezer Teeth Clean Tools Dentistry Instrument","0.3149"
"Dental Mirror 1 Piece Mouth Mirror Stainless Steel Surgical Tools Mouth Tools Profession By Ht","1.543"
"Codyson Cd-4862 Ultrasonic","393.418"
"Dental Dental Stainless Steel Tweezers Lab Equipment Best Quality Of Dental Instruments","9.415"
"Dental Painless Dental Endodontic Periodontal Treatment","724.178"
"New Three Air Water Nozzle Tip/ 3 Ways Syringe","0.0441"
"Stainless Steel Dental Air Polisher Airflow With 360 Degree Nozzle Rotation / Dental Air Prophy Sandblasting Gun","157.43"
"Hot Selling China Ultrasonic Cleaner With Cheap Price,Uc-020S","157.43"
"China Factory Cheek Retractor Mouth Opener For Salon And Dental Clinic Teeth Whitening","1.575"
"Durable Quality Handheld Assistive","409.318"
"Popular Yjd108+109Fn Low Noise Dental Lab Brush Micromotor Max Speed 45000Rpm","220.402"
"Teeth Whitening Unit(Chair Side Attached) With Ce&Iso,Teeth Bleaching","1102.01"
"Korea Dental Brand Good Price Acrylic Resin For","157.43"
"Dental Natural Curve Rubber Comfortable Flexible Oral Mouth Prop","4.723"
"Cheapest And High Quality Dental High Speed Handpiece With Ce Iso","31.486"
"Dental Implant Stainless Steel Dental Explorer Probe | Caremed Instruments","0.3149"
"Dental Tartar Scraper Tarter Remover Tool Dental Pick Double Ended Dental Kit","0.0315"
"High Quality Dental Tweezer Dressing Low Moq Customized Dental Tweezers","0.3149"
"Dental Instrument Dental Extraction Forceps Set Adult Tooth Extracting Forceps","14.169"
"China Factory Low Price Dental Mouth Cheek Retractor With C Type","1.575"
"Better Breathe New Style Lung Respiratory Breath Exercise Breathing Trainer","3.149"
"Full Dental Oral Led Flash Mobile Photography Light Equipment","151.133"
"Manufacture Cheap 100% Preventing A Loose Pad Teeth Braces For Adults","11.965"
"Sy-E016 High Quality Dental Nitrous Oxide Sedation System Kit For Dental Clinic","944.58"
"Dental Teeth Whitening Machine Machine Blanchiment Dentaire Professionnel Lampe Blanchiment Dentaire","613.977"
"High Technology Handpiece 4 Holes Press Water Dental Hand Piece","69.27"
"Amazon Hot Sale Pack Of Teeth Grinding Night Protector Athletic Mouth Guard Dental Night Guard","1.386"
"Design Dental Plastic Retainer Instrument Box Retainer Case","0.9446"
"2021 Wholesale Pa-01 Rgb+1 Facial Beauty Selectable Benefits Ultimate And Personalized Facial Treatment","2204.02"
"Dental Chair Clampable Teeth Whitening Bleaching Lamp Dental Cold Light Instrument 110V/220V","103.904"
"Dental Disposable Hot Sale Imported Stainless Holding Needle","0.0315"
"Xr High-Quality Dental Consumables Color-Coded Gutta-Percha Tip Filling Material Gp For Dental Use","5.259"
"Dressing Surgical Dental Tweezers Forceps Dental Lab Dental Instrument Tweezers","6.266"
"Implant Surgical Instruments Kit Dental Bone Surgery Preparing Set Prf Box","157.43"
"Teeth Cleaning Dental Hygiene Kit 4 Tools Set Dentist Approved /Dental Explorers /1 X 4 Adult Green Hexagonal Green","9.446"
"Wholesale Price Electrosurgical Bayonet Bipolar Forceps Surgical Instruments Diathermy Forceps","9.446"
"Digital Led Display Dental Equipment Intraoral Camera Dental Endoscope Monitor For Dental Clinic","519.519"
"Dental Equipment High Quality Dental Handpiece Oil Lubrication Machine And Cleaner","299.117"
"Wholesale Price Electrosurgical Bayonet Bipolar Forceps Surgical Instruments Diathermy Forceps","6.298"
"15Pcs Multicolor Dental Dentist Rubber Dam Clamp Set Orthodontic Material Dentist Lab Perforator Puncher Teeth Care Plier","0.6298"
"Dental Tools Kit 6Pcs Teeth Cleaning Tools Set Oral Care Kit With Tooth Pick High Quality In Wholesale Low Price","7.242"
"Bone Compression Kit Surgical Implant Dental Surgery Instruments","220.402"
"Manufacture Stainless Steel Surgical Bone Holding Forceps","110.201"
"Dr Whiten Dental Whitening Kit Bleaching Accelerator","47.229"
"Hot Sale Lower Price Good Quality Teeth Root Canal Dental Gates Drills Files","6.298"
"Classical Adec Dental Unit Functional Clinic Hydraulic Dental Chair","6923.772"
"Eco Dental Composite Sets New 6 Pcs Dental Composite Instruments Gold Complete Set With Kit Orthodontic Plier By Dh","37.784"
"Dental Equipment Spot Welder Machine Instruments","23614.5"
"Dental Myricko 4-Hole High Speed Dental Handpiece With Push Button","45.214"
"Root Fragment Stieglitz Stainless Steel Dental Instruments Stainless Steel Instruments","10.548"
"Factory Wholesale Manufacture Price Cheap China Dental Needle Irrigation","1.26"
"Dental Orthodontic Wire Bending Weingart Pliers Set With Tc Ortho","15.743"
"Dental Extracting Forceps Pattern Made With Grade Steel","14.327"
"High Quality Single Use Plastic .Handle Dental Mirror. Dental Examination Diagnostic Mouth Mirror","1.575"
"Codyson Dental Tools Ultrasonic Cleaner With Ce Rohs Gs Approval Cd - 4821","173.551"
"Dental Lab Denture Dental Flexible Denture Dental Price","132.242"
"Dental Orthodontic Root Tip Elevator Dentistry Dentist Instrument Full Stainless Steel","5.038"
"2021 Wholesale Factory Store Hospital Equipment Cpap Machine With Humidifier Nlf-200C","14168.7"
"Ysden-Seal06 Dental Sealing Machine Dental Unit Instrument","818.636"
"Minter Dental Endodontic Treatment Wireless Brushless Endo Motor With Apex Locator Rechargeable Base","563.6"
"Disposable Dental Oral Cavity Kit","0.3149"
"Sunlight Dental Unit With High Quality Dental Chair With Two Dentist Stool","3148.6"
"Hot Selling China Ultrasonic Cleaner With Cheap Price,Uc-60S","629.72"
"Good Price Dental Teeth Whitening Accelerator","62.972"
"New Hot Selling High-Quality Laser Pen High-Power Laser Pen","15743"
"Dental Handpiece Cleaning Lubricate System","278.841"
"Dental Equipment'S Dental Implant Stainless Steel Explorer Probe | Caremed Instruments","0.3149"
"Portable Digital Rvg Dental X-Ray Sensor X Ray Dental Xray Sensor","3085.628"
"Dental Cleaning Kit Including Stainless Steel Scaler Probe Excavator And Mouth Mirror","0.0315"
"Dental Impression Trays Set Of 6 Stainless Steel Health Perforated Autoclavable","3.118"
"3Pcs/Set Tooth Orthodontic Trainer Silicone Material Guard","11.021"
"Good Quality Plastic/Polymer S/M/L Autoclave Dental Impression Tray Dental Model Base For Treatment","7.557"
"Dental Mini 0.022 Sets Metal Teeth Orthodontic Bracket","4.062"
"Dental Supplies Colorful Disposable Nylon Dual-Use Polishing Soft Cup","0.1638"
"Best Selling Xr Good Dental Ultrasound Scaler For Application","623.423"
"Teeth Polishing Handpiece Dental Hand Piece 4 Holes Press Water Dental Handpiece","66.121"
"Dental Composite Sets New 6 Pcs Dental Composite Instruments Gold Complete Set With Kit Orthodontic Plier By Dh","40.932"
"Dental Care Set Tooth Cleaning Tartar Dental Oral Hygiene Kit High Quality In Wholesale Low Price","6.14"
"Dental Equipment Handpiece Scaler Light Cure Oral Camera Air Compressor Clinic Cheap Dental Chair Set","7833.717"
"Root Elevators Bein 2Mm Dental Surgical Instruments The Basis Of Surgical Instruments","4.251"
"Cleaning Board Sedimentation Tank Gypsum Filter Dental Laboratory Equipment","122.796"
"Dentist Orthodontic Adson Tc Forceps Surgical Tweezers Manufacturer Dental Tweezer","6.266"
"Portable Dental Cleaning Dental Ultrasonic Scaler Machine Dental Scaler Tips","220.402"
">Dental Orthodontic Root Elevator 720/27 720/28 Dentistry Dentist Instrument Full Stainless Steel","5.038"
"Dental Lab 3D Printed Partial Dentures Denture Dental Silicone","132.242"
"Dental Implant Box - High Grade Prf And Grf Box","157.43"
"Hot Selling China Ultrasonic Cleaner With Cheap Price,Uc-031S","472.29"
"Dental Elevator Root Luxuriating Curved Tip Stainless Steel Elevators | Caremed Instruments","6.298"
"Dental Scraper Tool Stainless Steel Dental Tarter Scraper For Tooth Dentist","0.0315"
"Excellent Quality Stainless Steel Dental Instruments Long Dentist Mouth Mirror","6.298"
"Health & Design For Dental Tweezer Dental Instruments Equipment","3.118"
"Hot Selling Plastic/Polymer S/M/L Autoclave Dental Impression Tray Dental Base Plate For Treatment","7.557"
"Manufacture Cheap 50 Set Teeth Orthodontics Braces Mbt Orthodontic Brackets","4.346"
"Designed For Tooth Green Cleaning Hard Root Canal Cleaning Brush","0.4723"
"Xr Filling Auxiliary Materials Endo-Points Gutta Percha Points With Depth Marked 04 Taper For Dental","6.613"
"Best Selling Cone Beam Ct Multifunctional Dental Cbct Radiology Equipment","78715"
"2022 Hot Dental Orthodontic Oem Tear Drop Thermal Forming Plier Orthodontic Aligner Plier Clear Appliance Instrument","141.687"
"Electronic Oem Blood Glucose Test Diabetic Machine","9.446"
"Portable Sphygmomanometer Bp Monitor Checking Professional Upper Arm Digital Ambulatory Manual Blood Pressure Monitor","25.158"
"Handheld Dynamic Ecg Systems 12 Channel 24 Hours Holter Ecg","752.516"
"Blood Sugar Testing Equipment Portable Blood Glucometer","23.615"
"Blood Pressure Cofoe Wholesale Bp Monitor Automatic Arm Blood Pressure Monitor","24.874"
"Upper Arm Blood Pressure Monitor Sphygmomanometer","23.615"
"Bp Blood Pressure Monitor Other","25.189"
"Self Monitoring Portable Intelligent Digital Blood Glucose Meter Glucometer Strips Blood Glucose Meter","12.5"
"Cheap Price Insumos Medicos Equipos Ultrasonic Portable Asthma Inhaler Mesh Nebulizer Machine","25.189"
"Handheld Nebulizers Inhaler Ultrasonic Mesh Nebulizer Portable Nebulizador Portatil","23.615"
"Arm Type Digital Blood Pressure Electronic Bp Machines","20.466"
"Physical Therapy Equipments Atomizers Portable Mesh Nebulizer Inhaler Suction Machine","37.784"
"Other One Button Start Portable Mahince Nebulize Ultrasonic Inhaler","28.338"
"High Quality Sphygmomanometer Arm Tensiometers Oem Bp Machine Electronic Blood Pressure Monitor Other","25.158"
"Factory Price Accu Answer 4 In 1 Blood Glucose Meter Cholesterol And Uric Acid Hemoglobin Meter","72.418"
"Other Blood Pressure Testing Equipments Tensiometro Manual","12.595"
"Other Led Light Therapy Pdt Treatment Body Pain Relief","170.025"
"6 In 1 Smart Telemedicine Ecg Holter Sp02 Temperature Blood Sugar Sensor All In One Portable","330.603"
"Supplies Other Equipment Ultrasonic Portable Inhaler Mesh Nebulizer Machine","18.861"
"Homecare Ne-J01 Mini Nebulizer Oxygen Concentrator Nebulizer","28.338"
"My-G029G Arm Electronic Sphygmomanometer Digital Blood Pressure Monitor","25.189"
"Ce Certified 5-Second Rapid Blood Glucose Meter Accurately Tests","16.058"
"Upper Arm Digital Apparatus Blood Pressure Monitor Other","21.065"
"Hot Millimeter Wave Instrument For Body Care And Disease Therapy","2200.872"
"Hot Selling Hospital Equipment Automatic Portable Cpap Machine Bipap Apap For Night Sleep Snoring Home Use","566.748"
"Manufacturers Sale Grade Inhalation Nebulizer Compressor Other","31.486"
"Best Selling Products And Supplies Portable Compressor Nebulizer Machine","29.912"
"Tensiometro Manual Blood Pressure Monitor Aneroid Sphygmomanometer With Stethoscope","15.114"
"Durable Sprayers Portable Compression Nebulizer Health Care","22.041"
"Upper Arm Bp Monitor Blood Pressure With Large Cuff 22-42Cm For Adult Bp Equipment","43.766"
"Durable Sprayers Portable Compression Nebulizer Health Care","30.857"
"Hes-3 Digital Vital Monitor Mobile Equipment Handheld Portable Telemedicine For Clinic","3148.6"
"Wholesale Berrcom Other Bp Cuff Sphygmomanometer Smart Blood Pressure Monitor","37.815"
"Supplies Other Equipment Ultrasonic Portable Inhaler Mesh Nebulizer Machine","28.338"
"Other Other Consumables Tubing Wrap Soft Cpap/Bilevel Hose Tube Cove","34.635"
"Factory Cuastom Upper Arm Digital Bp Apparatus Blood Pressure Monitor Other","21.065"
"Health Supplies Other Handheld Portable Handheld Pulse Oximeter Equipment","179.471"
"Jasun Fast Dispatch Low Noise Inhalation Mesh Nebulizer For Care For Cough Other","37.784"
"Starcare Other Consumables Digital Thermometer Flexible Tip Baby Care","1.512"
"High Quality Portable Nebulization O2 Oxygen Concentrator Generator For Room","346.346"
"Other Aviche A35 1-5L Oxygen Concentrator With Nebulizer","755.664"
"Choicemmed Electrocardiografo Ekg Recorder Elettrocardiografo Wireless Monitor Blue Tooth Ecg Machine Md100B","206.234"
"Blood Pressure Machine For Home Use Healthcare Supply Wholesale Korean","62.972"
"Competitive Price Thermometer Thermometer Baby Digital Thermometer","1.323"
"Factory Price Mute Mini Home Inhaler Ultrasonic Atomizer Usb Portable Handheld Mesh Nebulizer","29.881"
"Hospital Healthcare Equipment Machine Equipment Home Care Electric Suction Machine","147.985"
"Portable Ecg Machine Pocket Ecg Holter Holter Ecg","280.226"
"Manual Aneroid Sphygmomanometer Blood Pressure Monitor Meter Tonometer Cuff Measure With Stethoscope Home","14.169"
"Health Care Lcd Thermometers Checking Oral Thermometer","0.7872"
"Stable Performance High Efficiency Other 5L 10L Grade Oxygen-Concentrator","591.937"
"Wireless Portable Knee Massage , Health & Portable Electronic Knee Massager Warm Laser","94.458"
"Berry Professional Cheap Nice Big Display Pulse Oximeter Fingertip","9.446"
"Konheal Cytometer Ce Hospital Baby Digital Handheld Finger Clip Fingertip Pulse Oximeter","9.415"
"Ce Iso Approved Home Supplies Portable Compressor Electronic Diffuser Nebulizer","64.547"
"Orientemd Best Mercury Sphygmomanometer With Ce Iso","27.078"
"Factory Nebulizer Machine Compact Inhaler Electric Compressor Nebulizer","32.746"
"Battery Operated Ultrasonic Nebulizer For Asthma Portable Electric Inhaler Machine","88.161"
"Standard Supplies Blood Pressure Monitoring Arm Blood Pressure Meter","21.096"
"Berrcom New Product Lcd Screen Thermometer Children'S Thermometer Fever Thermometer","1.575"
"2022 Intelligent Type Electronic Blood Pressure Monitor-Upper Arm Type","18.262"
"Best Selling Durable Electronic Sphygmomanometer","20.466"
"Hra-Ii Disease Detective Machines For High Blood Pressure,Diabetes, No Harm To The Body","3.149"
"Yuwell Manual Desktop Blood Pressure Measuring Instrument Upper Arm Type Arm Type Measuring Sphygmomanometer","472.29"
"New High Quality Good Price Four Ball Breathing Trainer Lung Capacity Lung Function Exercise Rehabilitation","21.726"
"Spo2 Monitor Equipment Bluetooth To Test The User Oxygen Saturation And Pr Finger Pulse Oximeter","47.229"
"Top Selling Automatic Free Turgoscope B05 And Blood Pressure Monitor With Lcd Display","28.653"
"Diabetes Digital Test Strips International Blood Sugar Meters Monitors Electronic Digital Blood Glucose Meter","22.041"
"Eg20 New Products Family Home Use Snap Ecg /Portable Mini Ecg Machine","157.43"
"Electronic Wrist Hot Sale Figital Wrist Blood Pressure Monitor","37.784"
"Professional Dual Head Cardiology Cute Stethoscope For Doctor Nurse Vet Student Chest Piece","3.936"
"Factory Price Electric Nasal Irrigation Nose Cleaning For Use","37.784"
"Blood Pressure Monitor, Portable Or Aneroid Sphygmomanometer With Stethoscope","18.892"
"Hochey Elderly Monitoring Pediatric Blood Pressure Sphygmomanometer Infant Smart Bp Monitor","25.189"
"Blood Glucose Meter For Measuring Blood Sugar Glucometer With Diabetic Test Strips For Diabetes Glucometro","19.301"
"Professional Hospital Upper Arm Digital Blood Pressure Monitor With Lcd Display","34.635"
"Clinical Electronic Sphygmomanometer Arm Digital Bp Machine Blood Pressure Monitor Factory","20.781"
"Sphygmomanometer Arm Wrist Digital Blood Pressure Monitor","31.455"
"Handheld Baby Cvs Asthma Inhaler Mesh Nebulizer Machine Portable Ultrasonic Nebulisers Nebulizador Portatil","31.172"
"Oem Color Nebulizer Inhaler Compressor Nebulizer Listed On Amazon","29.031"
"Blood Pressure Monitor With Ye660E Family Heath Care Electric Plastic Ce Yuwell Large Lcd Display","53.527"
"High Quality Non Invasion Machine Test Blood Sugar Monitor With Test Strip Blood Glucose Meter","30.857"
"Oxygen Oxygen Concentrator 5L High Capacity Portable Cheap Wholesale Price","629.72"
"Ozone Generator Ozone Machine Ozone Air Purifier Sterilization Disinfection Formaldehyde Odor Removal","374.684"
"Home Use Portable Oxygen Generator Factory Price 93% High Purity Portable Oxygen Concentrator Oxygen","425.061"
"Mini First Aid Kit For Car Use Or Outdoor Travel Use","12.563"
"Clinical 8D Nls Blood Pressure Monitor Cardiovascular System Health Protection Instrument","1007.552"
"Wholesale House Use Checking Arm Type Electronic Bp Blood Pressure Check Machines Digital","14.169"
"Blood Sugar Test Machine Multifunctional Intelligent Noninvasive Optima Blood Glucose Meter","19.837"
"Mini Cough Drug Portable Handheld Inhaler Baby Mesk Nebulizers Nebul Mesh Ultrasonic Nebulizer For Children","26.764"
"All In One Telehealth Homecare Blood Pressure Monitor Diabetes Monitor Glucometro","330.603"
"Other Blood Pressure","25.189"
"Hospital Digital Bp Monitor Machine Cheap Upper Arm Blood Pressure Monitor Price","23.615"
"Pain Relief Photodynamic Therapy For Menstrual Pain Sports Injuries Wound Healing","3.149"
"Digital Blood Pressure Monitor","21.411"
"Pdt Therapy Other Pain Relief Photodynamic Skin Care","1133.496"
"Manufacture Health Homecare Ce Approved Smart Ultrasound Handheld Mesh Nebulizer Diffuser","34.005"
"Wholesale Remote Monitoring Arm Type Blood Pressure Monitor","62.658"
"Smart Blood Pressure Machine Aneroid Sphygmomanometer Bp Apparatus Smart Digit Blood Pressure Monitor","49.119"
"Handheld Atomizer Nebulizador Mesh Nebuliz Portatil Mini Handheld Portable Inhale Nebulizer","23.898"
"Lastek New Inventions Cold Laser Therapi Diabetic Watch For Blood Pressure Other","236.145"
"European Standard Other Heart Rate Spo2 App Finger Monitor Eos Pulse Ecg Card","214.105"
"New Arrival Other Low Price Blood Pressure Monitor Wrist Blood Pressure Monitor","20.089"
"Wholesale Berrcom Other Sphygmomanometer Smart Bp Cuff Blood Pressure Monitor","37.815"
"Other Physical Therapy Equipments Atomizers Portable Mesh Nebulizer Inhaler Suction Machine","37.784"
"2022 New Arrived Bp Meter Speaker Wrist Blood Pressure Monitor","30.542"
"Fasting Blood Sugar Test Monitor Other Blood Glucose Strips Test Strips","15.743"
"Nebulizer Machine Electric Asthma Nebulizer","31.486"
"Wholesale Other Bp Adjustable Cuff Sphygmomanometer Digital Blood Pressure Monitor","26.764"
"New Design High Quality Yellow Back Glass Thermometer Glass Clinical Thermometer","1.103"
"Health Fitness Hospital Arm Digital Blood Pressure Monitor","17.601"
"Home Blood Pressure Promotion Sphygmomanometer Diagnostic Test","15.743"
"Ce Approved Physical Therapy Equipments Air Massage Therapy For Full Legs And Hipster Circulation And Relaxation","724.178"
"Pm50 Wireless Multiparameter Patient Monitoring Vital Signs Telemedicine","406.17"
"Manual Aneroid Sphygmomanometer Blood Pressure Monitor Meter Tonometer Cuff Measure With Stethoscope Home","14.169"
"Health Blood Glucose Meter Accu Chek Glucose Meter Machine Other Product","22.985"
"Diabetes Equipment Blood Sugar Testing With Test Paper","11.021"
"Sejoy Equipment Strips For Glucometer","1.575"
"Factory Direct Paralysis Negative Pressure Sputum Suction Baby Electric Sputum Suction","141.687"
"Home Use Bp Machine Sphygmomanometer Arm Tensiometers Electronic Blood Pressure Monitor","25.158"
"Oem Manufacturer Baby Temperature Clinical Digital Thermometers","1.354"
"Good Price Healthcare Products Electric Mode Power Wheelchair Foldable Electric Wheelchair","879.09"
"Biobase Equipment Wheelchairs Manual Lightweight Folding Electric Wheelchair","251.888"
"Biobase Mfw880L Rehabilitation Disabled Use Electronic Smart Wheelchair","251.888"
"Artificial Limbs Implant Prosthetic Leg Parts Below Knee Joint For Leg Prosthesis","173.173"
"Elderly Used Manual Travel Wheelchair Mt Comfortable Elderly Used Manual Travel Wheelchair For Disabled","81.864"
"Contactless Humanl Scanner Temperature Meter Forehead Thermometer","25.189"
"Ce Physiotherapy Orthopedic Elbow Joint Protector Orthosis Brace Support Splint With Dynamic Rom","48.489"
"Whole-Body Functional Training Equipment With Intelligent Sensor","34603.114"
"Folding Walking Aid Walker Frame For Disabled Crutch Lightweight Standing Frame Aluminum Hospital","12.595"
"New Design Magnetotherapy Equipment Pain Relief Electromagnetic Magnetic Super Transduction Pm-St","6294.052"
"Lastek Ces Shock Wave Insomnia Sleep Aid Physical Therapy Equipment","188.916"
"Hydrocollator With Hot Packs","4093.18"
"Hospital Rehabilitation Equipment Rehabilitation Walking Frame Walking Assist","724.178"
"Orthopedic Adjustable Hip And Knee Brace Support Protector Orthosis Rehabilitation With Hinge For Fracture Adult","330.603"
"Fes Foot Drop System Xft G3 Walking Rehab For Drop Foot Treatment","94.458"
"Elastic Neoprene Hinged Knee Brace","80.857"
"Hospital Rehabilitation Equipment Rehabilitation Walking Frame Walking Assist","724.178"
"Good Effect Ed Electromagnetic Extracorporeal Shock Wave Therapy Machine Pain Relief","4678.82"
"Made In Italy Premium Quality Muscle Modeling Slimming Machine For Export","26218.393"
"Equipment Electric Patient Lifter Disabled Transfer - Transfer Chair, Lifting","2830.592"
"Foot Drop Treatment Xft-2001D Stroke Rehabilitation","94.458"
"Dms Deep Muscle Stimulator Physiotherapy","2833.74"
"Adjustable Orthopedic Jewett Brace","175.378"
"Top Quality Italian Nhc 1.5Ata Mc750 Hard Type Hyperbaric Chamber Cabin For Use","9326.154"
"Physiotherapy Hand Stroke Finger Exercise Training Function Equipment Robot Hand Rehabilitation","613.977"
"Rehabilitation Robot Manufacture Gait Rehabilitation Training","787150"
"Prosthetic Orthopaedic Suppliers For Sale Hand Rehabilitation","26.764"
"Teleco High Quality Neck Traction By Air Cervical Collar For Neck Disc Herniation","94.458"
"Special Selling New Model Comfortable Walking Assist","75.567"
"Knee Lower Limb Rehabilitation Training","4880.33"
"Portable Neck Stretcher Decompression And Pain Relief Physiotherapy Equipment Cervical Vertebra Traction","113.35"
"Ces Sleeping Treatment No Side Effect Anti Insomnia Therapy For Home Use","188.916"
"Lumbar Traction","503.776"
"Rehabilitation Equipment Stroke Patient Recovery Hand Exercises","944.58"
"Msloe1251 Limbs Rehabilitation For Active And Passive Rehabilitation Training","314.86"
"Portable Physiotherapy Vest Airway Clearance System Vibrator For Child And Adult","7871.5"
"Fes Stroke Rehabilitation Foot Drop System Healthcare Footdrop","94.458"
"Sling Exercise Equipment Suspension Therapy System With Ceiling Track For Children Set For Exercise In Suspension","13494.9"
"Folding Powered Mobility Scooter Chair Electric Wheelchair Chair For The Elderly Rehabilitation","4417.486"
"Orthopedics Rehabilitation And Physiotherapy Extracorporeal Shock Wave Therapy Equipment Eswt","2141.048"
"Hospital Physiotherapy Rehabilitation Equipment Lower Limb Physical Therapy","2833.74"
"Bmc Gii Auto Cpap E-20A Healthcare Portable Sleep Apnea Anti Snoring Home Use With Humidifier Free Parts","1102.01"
"Elderly Wheelchair Assistant Disable Stepping Wheelchair Aids Stair Climbing Machine Electric Steps Climbing Machine","2015.104"
"Physical Therapy Gait Training Equipment Rehabilitation","14168.7"
"Sling Exercise Therapy (S-E-T) For Child Balance Training Rehabilitation Training","3.149"
"Shoulder Arm Abduction Orthosis Rehabilitation Post Op","62.972"
"Passive Training Hand Therapy Equipment - Advanced Occupational Therapy Finger Rehabilitation Robotics","469.142"
"Orthopedic Ankle Joint Protection Fixation","93.388"
"Eminent Upgraded Height Adjustable Rehabilitation Fixed Support Orthopedic Thoracolumbar Brace","119.332"
"Top Quality Lightweight Osteoarthritis Oa Knee Brace Hinged Knee Brace","78.715"
"Afo Foot Drop Brace Ankle Foot Orthosis Support Drop Foot Postural Correction Brace","22.041"
"Walker Fracture Boot Tall- Full Recovery, Protection And Healing Walking Boot - Toe, Foot Or Ankle Injuries","93.829"
"Disposable Supply Post Surgery Compression Bra (P)","31.486"
"Health Care Rollator Convenient For Disabled Folding Adjustable Walker Physiotherapy Equipment With Double Hand Brake","31.486"
"6 Sections Chiropractic Bed Treatmeat Equipment Rehabilitation Machine","14168.7"
"Comfortable Adjustable Disabled Aluminum Alloy Elbow Underarm Crutch","4.723"
"13Cm Cast Elastic Surgical Carbon Fiber Stockinette Cover For Prosthetic Legs","62.972"
